Post_Date,Neighborhood,Price,Title,Url,Bedroom,sqft
2022-08-18 01:54:00,"308 4Th Ave S , Seattle-Tacoma, Wa",1359.0,"Vintage Moldings, Controlled Access/Gated, Elevator",https://seattle.craigslist.org/see/apa/d/seattle-vintage-moldings-controlled/7520360658.html,,128.0
2022-08-18 01:51:00,"1321 Minor Ave, Seattle, Wa",1995.0,1BR 1BA apt | Open living room | Fully-equipped kitchen | In-home W/D,https://seattle.craigslist.org/see/apa/d/seattle-1br-1ba-apt-open-living-room/7516652817.html,1.0,647.0
2022-08-18 01:46:00,"First Hill, Yesler Terrace, Capitol Hill",1535.0,"Top-Floor Move-In-Ready Studio Apartment! Bike Storage, Rooftop w/BBQ!",https://seattle.craigslist.org/see/apa/d/seattle-top-floor-move-in-ready-studio/7519303692.html,,400.0
2022-08-18 01:41:00,Seattle,2195.0,"Belltown studio, Furnished, Great Location!",https://seattle.craigslist.org/see/apa/d/seattle-belltown-studio-furnished-great/7522823767.html,,
2022-08-18 01:09:00,"1820 Minor Ave , Seattle, Wa",1379.0,"Open Concept Floor Plans, Window Coverings, High Speed Internet",https://seattle.craigslist.org/see/apa/d/seattle-open-concept-floor-plans-window/7521171133.html,,344.0
2022-08-18 00:59:00,"2510 Western Avenue, Suite 100 , Seattle, Wa",1490.0,"Upgraded Appliances, Superior Maintenance, Trendy Accent Walls",https://seattle.craigslist.org/see/apa/d/seattle-upgraded-appliances-superior/7521966165.html,,444.0
2022-08-18 00:52:00,"255 Lenora St, Seattle, Wa",5608.0,Two Story Loft - Flexible Workspaces and Onsite Tesla Rental!,https://seattle.craigslist.org/see/apa/d/seattle-two-story-loft-flexible/7516225905.html,1.0,1111.0
2022-08-18 00:43:00,"915 E Spruce St, Seattle, Wa",1930.0,"E-Facing 1bed w/Tons of Storage, Stainless Steel Appliances!",https://seattle.craigslist.org/see/apa/d/seattle-facing-1bed-tons-of-storage/7519342422.html,1.0,502.0
2022-08-18 00:35:00,Seattle,1875.0,One month free on select homes!,https://seattle.craigslist.org/see/apa/d/seattle-one-month-free-on-select-homes/7515068773.html,1.0,540.0
2022-08-18 00:30:00,"3231 S 204Th St, Seatac, Wa",1639.0,"Clubhouse, Cable Ready, Wood Burning Fireplace",https://seattle.craigslist.org/see/apa/d/seattle-clubhouse-cable-ready-wood/7517519784.html,1.0,725.0
2022-08-18 00:28:00,"2510 Western Avenue, Suite 100 , Seattle, Wa",1490.0,"Pet Friendly, Planned Social Activities, Zero Deposit Community",https://seattle.craigslist.org/see/apa/d/seattle-pet-friendly-planned-social/7521970412.html,,444.0
2022-08-18 00:27:00,"905 Dexter Ave N, Seattle, Wa",2044.0,Spacious Studio with Large Bay Window,https://seattle.craigslist.org/see/apa/d/seattle-spacious-studio-with-large-bay/7517778002.html,,506.0
2022-08-18 00:22:00,"308 4Th Ave S , Seattle-Tacoma, Wa",1359.0,"9-Foot Ceilings, Historic Building, Hardwood Floors",https://seattle.craigslist.org/see/apa/d/seattle-foot-ceilings-historic-building/7521969944.html,,128.0
2022-08-18 00:16:00,Lake Forest Park,750.0,1 Private Room for Rent in Lake Forest Park/Shoreline,https://seattle.craigslist.org/see/apa/d/seattle-private-room-for-rent-in-lake/7522819427.html,1.0,110.0
2022-08-18 00:11:00,Kent,1935.0,"Walk-In Closets, New Lighting, Life-Size Foosball",https://seattle.craigslist.org/see/apa/d/seattle-walk-in-closets-new-lighting/7517060322.html,1.0,748.0
2022-08-18 00:06:00,"2624 Western Avenue, Seattle, Wa",1699.0,"Month to month LEASE Option! 2BR apt, Pets welcome, Kitchen has it all",https://seattle.craigslist.org/see/apa/d/seattle-month-to-month-lease-option-2br/7520719884.html,2.0,550.0
2022-08-18 00:02:00,"2226 Elliott Ave, Seattle, Wa",3670.0,2BR 2BA apt | Deluxe kitchen | Spacious plan | Private deck w/ storage,https://seattle.craigslist.org/see/apa/d/seattle-2br-2ba-apt-deluxe-kitchen/7521952719.html,2.0,900.0
2022-08-17 23:55:00,Seattle,1100.0,6-Month Lease - Security Deposit: $400.00 Best Rent Downtown Seattle!,https://seattle.craigslist.org/see/apa/d/seattle-month-lease-security-deposit/7522818023.html,,
2022-08-17 23:44:00,"308 4Th Ave S , Seattle-Tacoma, Wa",1456.0,"Close to Freeway, Walk-In Shower, Large Windows",https://seattle.craigslist.org/see/apa/d/seattle-close-to-freeway-walk-in-shower/7521964176.html,1.0,132.0
2022-08-17 23:43:00,Alki,5000.0,Infinity Shore Club,https://seattle.craigslist.org/see/apa/d/seattle-infinity-shore-club/7522816548.html,1.0,
2022-08-17 23:40:00,Seattle,1100.0,6-Month Lease - Security Deposit: $400.00 Best Rent Downtown Seattle!,https://seattle.craigslist.org/see/apa/d/seattle-month-lease-security-deposit/7522817052.html,,
2022-08-17 23:28:00,"14700 Ne 35Th St, Bellevue, Wa",2750.0,"WOW! kitchen, Bright rooms, Two-story 2BR Town Home, Pets are welcomed",https://seattle.craigslist.org/see/apa/d/bellevue-wow-kitchen-bright-rooms-two/7521955572.html,2.0,1057.0
2022-08-17 23:19:00,Greenwood,3500.0,Charming Spacious Apartment with Hardwood and Laundry Included,https://seattle.craigslist.org/see/apa/d/seattle-charming-spacious-apartment/7519962034.html,3.0,1550.0
2022-08-17 23:19:00,Greenwood,3500.0,Charming Spacious Apartment with Hardwood and Laundry Included,https://seattle.craigslist.org/see/apa/d/seattle-charming-spacious-apartment/7519962405.html,3.0,1550.0
2022-08-17 23:19:00,Ballard,2295.0,2 bed & 2 baths apartment,https://seattle.craigslist.org/see/apa/d/seattle-bed-baths-apartment/7519963348.html,2.0,1095.0
2022-08-17 23:19:00,1415 Nw 62Nd Street,1695.0,One Bed Big apartment,https://seattle.craigslist.org/see/apa/d/seattle-one-bed-big-apartment/7519964347.html,1.0,650.0
2022-08-17 22:52:00,"255 Lenora St, Seattle, Wa",3212.0,Unique Two Story Loft With City Views - 22 Foot Tall Windows!,https://seattle.craigslist.org/see/apa/d/seattle-unique-two-story-loft-with-city/7515379434.html,1.0,712.0
2022-08-17 22:48:00,"13543 Greenwood Ave N, Seattle, Wa",2495.0,We welcome you and your fur babies to your new home!,https://seattle.craigslist.org/see/apa/d/seattle-we-welcome-you-and-your-fur/7520320760.html,2.0,1100.0
2022-08-17 22:43:00,"714 7Th Avenue, Seattle, Wa",1263.0,"Zero Deposit Community, Extremely Close to Bus Lines, Claw Foot Tubs",https://seattle.craigslist.org/see/apa/d/seattle-zero-deposit-community/7521926849.html,,322.0
2022-08-17 22:41:00,"3490 Sw Graham St, Seattle-Tacoma, Wa",2525.0,2 bedrooms 2 baths - View Today - Move In Tomorrow,https://seattle.craigslist.org/see/apa/d/seattle-bedrooms-baths-view-today-move/7513346336.html,2.0,912.0
2022-08-17 22:34:00,"520 Occidental Ave S, Seattle, Wa",2229.0,"Quartz Countertops, Guest Suite, Stainless-Steel Appliances",https://seattle.craigslist.org/see/apa/d/seattle-quartz-countertops-guest-suite/7521061833.html,1.0,696.0
2022-08-17 22:33:00,Seattle,1615.0,"Elevator, Close to Shopping, Ceiling Fans",https://seattle.craigslist.org/see/apa/d/seattle-elevator-close-to-shopping/7512476119.html,,420.0
2022-08-17 22:28:00,"1820 Minor Ave , Seattle, Wa",1470.0,"Recycling, Window Coverings, Public Transportation",https://seattle.craigslist.org/see/apa/d/seattle-recycling-window-coverings/7521162686.html,1.0,500.0
2022-08-17 22:27:00,Uw/University District/Ravenna/Campus,8900.0,"Pre Lease Fall 2022 10Br, 4Ba, 2 kitchens Renovated in 1995",https://seattle.craigslist.org/see/apa/d/seattle-pre-lease-fall-br-4ba-kitchens/7513776784.html,8.0,3200.0
2022-08-17 22:26:00,"604 E Union St, Seattle, Wa",1400.0,"Spacious Closets, Hardwood Floors, Extra Storage",https://seattle.craigslist.org/see/apa/d/seattle-spacious-closets-hardwood/7521898099.html,,538.0
2022-08-17 22:24:00,"714 7Th Avenue, Seattle, Wa",1263.0,"Walking Distance to Everything You Need, Microwave, Claw Foot Tubs",https://seattle.craigslist.org/see/apa/d/seattle-walking-distance-to-everything/7521958095.html,,322.0
2022-08-17 22:20:00,"3231 S 204Th St, Seatac, Wa",2455.0,3 bedroom 2 bath Available end of August!!!!!,https://seattle.craigslist.org/see/apa/d/seattle-bedroom-bath-available-end-of/7522810166.html,3.0,1105.0
2022-08-17 22:10:00,"905 Dexter Ave N, Seattle, Wa",2981.0,Rooftop Corner Home with Upgraded Appliances!,https://seattle.craigslist.org/see/apa/d/seattle-rooftop-corner-home-with/7518585474.html,1.0,816.0
2022-08-17 22:06:00,Kenmore,2250.0,Condo for Rent in Downtown Kenmore,https://seattle.craigslist.org/see/apa/d/kenmore-condo-for-rent-in-downtown/7522808567.html,2.0,924.0
2022-08-17 22:06:00,"1321 Minor Ave, Seattle, Wa",1995.0,"Bright, open living room, 1BR apt with Large closets, Modern kitchen",https://seattle.craigslist.org/see/apa/d/seattle-bright-open-living-room-1br-apt/7521942920.html,1.0,647.0
2022-08-17 22:06:00,"308 4Th Ave S , Seattle-Tacoma, Wa",1456.0,"Microwave, Walk-In Shower, Dishwasher",https://seattle.craigslist.org/see/apa/d/seattle-microwave-walk-in-shower/7522808528.html,1.0,132.0
2022-08-17 22:05:00,Kent,1922.0,"Walk-In Closets, Mirrored Wardrobe Doors, Wood Look Flooring",https://seattle.craigslist.org/see/apa/d/seattle-walk-in-closets-mirrored/7517331194.html,2.0,864.0
2022-08-17 21:50:00,Redmend,500.0,Studios w/ Full Kitchen! Utilities paid w/ No Lease! 500 Weekly!!,https://seattle.craigslist.org/see/apa/d/redmond-studios-full-kitchen-utilities/7522806463.html,1.0,234.0
2022-08-17 21:40:00,"16100 Linden Ave N, Shoreline, Wa",1650.0,Enjoy the weather in your own spacious balcony!,https://seattle.craigslist.org/see/apa/d/seattle-enjoy-the-weather-in-your-own/7521920282.html,1.0,683.0
2022-08-17 21:38:00,"308 4Th Ave S , Seattle-Tacoma, Wa",1359.0,"Renovated Interiors, Close to Public Transportation, Hardwood Floors",https://seattle.craigslist.org/see/apa/d/seattle-renovated-interiors-close-to/7520366813.html,,128.0
2022-08-17 21:37:00,"First Hill, Capitol Hill, Yesler Terrace",1890.0,"Move-In Ready 1bed 1bath with Mountain View, Corner Unit, Amazing Sun!",https://seattle.craigslist.org/see/apa/d/seattle-move-in-ready-1bed-1bath-with/7517809826.html,1.0,530.0
2022-08-17 21:32:00,"4548 20Th Ave Ne, Seattle-Tacoma, Wa",900.0,"Secured Entry, Washer/Dryer On Site, On-Site Management",https://seattle.craigslist.org/see/apa/d/seattle-secured-entry-washer-dryer-on/7517340213.html,,
2022-08-17 21:13:00,"308 4Th Ave S , Seattle-Tacoma, Wa",1359.0,"Fitness Center, Stainless Steel Appliances, Online Payments Available",https://seattle.craigslist.org/see/apa/d/seattle-fitness-center-stainless-steel/7522801480.html,,186.0
2022-08-17 21:11:00,Queen Anne Seattle,1895.0,Queen Anne fourplex,https://seattle.craigslist.org/see/apa/d/seattle-queen-anne-fourplex/7522800785.html,2.0,645.0
2022-08-17 21:09:00,"3231 S 204Th St, Seatac, Wa",1537.0,"Stainless Steel Appliances, Package Receiving, Electric Range",https://seattle.craigslist.org/see/apa/d/seattle-stainless-steel-appliances/7522800770.html,1.0,725.0
2022-08-17 21:01:00,"25102 62Nd Avenue South, Kent, Wa",1677.0,"10 foot Ceilings, Storage Loft, Huge Bathroom",https://seattle.craigslist.org/see/apa/d/seattle-10-foot-ceilings-storage-loft/7519521389.html,1.0,550.0
2022-08-17 21:01:00,Bellevue,2195.0,Stainless kitchen | Bellevue 1BR apt | W/D inside | Deck with storage,https://seattle.craigslist.org/see/apa/d/bellevue-stainless-kitchen-bellevue-1br/7512170081.html,1.0,700.0
2022-08-17 20:52:00,"2615 1St Avenue, Seattle, Wa",2200.0,"Ideal 1BR apt has Walk-in closet, Modern kitchen, Washer/Dryer inside",https://seattle.craigslist.org/see/apa/d/seattle-ideal-1br-apt-has-walk-in/7516692923.html,1.0,654.0
2022-08-17 20:49:00,"255 Lenora St, Seattle, Wa",5683.0,"Skyline views, modern luxury, and unique amenities seamlessly merged.",https://seattle.craigslist.org/see/apa/d/seattle-skyline-views-modern-luxury-and/7520256213.html,2.0,1286.0
2022-08-17 20:45:00,"1820 Minor Ave , Seattle, Wa",1800.0,"Laundry Facilities, Open Concept Floor Plans, Elevator",https://seattle.craigslist.org/see/apa/d/seattle-laundry-facilities-open-concept/7521142656.html,,384.0
2022-08-17 20:44:00,"2615 1St Avenue, Seattle, Wa",2206.0,"1BR apt, Large windows, Modern kitchen, Generous cabinets & closets",https://seattle.craigslist.org/see/apa/d/seattle-1br-apt-large-windows-modern/7522796708.html,1.0,819.0
2022-08-17 20:43:00,"16100 Linden Ave N, Shoreline, Wa",1650.0,In home washer and dryer!,https://seattle.craigslist.org/see/apa/d/seattle-in-home-washer-and-dryer/7520315870.html,1.0,683.0
2022-08-17 20:41:00,"2619 5Th Avenue, Seattle, Wa",1449.0,"Internet Ready, Walk-In Closets, Old World Charm Crown Molding",https://seattle.craigslist.org/see/apa/d/seattle-internet-ready-walk-in-closets/7521931404.html,,410.0
2022-08-17 20:40:00,"2510 Western Avenue, Suite 100 , Seattle, Wa",1489.0,"Walk-In Closets, Courtyard, Close to Public Transportation",https://seattle.craigslist.org/see/apa/d/seattle-walk-in-closets-courtyard-close/7522796134.html,,444.0
2022-08-17 20:36:00,Delridge / West Seattle,2255.0,Pre-Lease for October! Spend The Holidays With Us At Delridge Crossing,https://seattle.craigslist.org/see/apa/d/seattle-pre-lease-for-october-spend-the/7511332450.html,2.0,861.0
2022-08-17 20:35:00,"4117 124Th Ave Se, Bellevue, Wa",2195.0,1BR 1BA apt :: Wood-style flooring :: LUX kitchen :: has Washer/Dryer,https://seattle.craigslist.org/see/apa/d/bellevue-1br-1ba-apt-wood-style/7522795159.html,1.0,700.0
2022-08-17 20:31:00,Judkins Park/Central District,2400.0,2 Bed - 1 Bath - Beautiful - Modern,https://seattle.craigslist.org/see/apa/d/seattle-bed-bath-beautiful-modern/7522794435.html,2.0,950.0
2022-08-17 20:27:00,"Seatac, Wa 98198",1884.0,"Fitness Center, Private Balcony or Patio, Electric Range",https://seattle.craigslist.org/see/apa/d/seattle-fitness-center-private-balcony/7521936653.html,2.0,900.0
2022-08-17 20:26:00,"15300 Southeast 155Th Place, Renton, Wa",2565.0,"Patio/Balcony, BBQ, Plenty of closet space.",https://seattle.craigslist.org/see/apa/d/renton-patio-balcony-bbq-plenty-of/7519347755.html,2.0,1091.0
2022-08-17 20:26:00,Seattle,1915.0,"Elevator, Bike Storage, Media Room",https://seattle.craigslist.org/see/apa/d/seattle-elevator-bike-storage-media-room/7512204815.html,1.0,540.0
2022-08-17 20:26:00,Seattle,2650.0,Signature Pointe is the most spacious apartments you could ever find!,https://seattle.craigslist.org/see/apa/d/seattle-signature-pointe-is-the-most/7513801719.html,3.0,1300.0
2022-08-17 20:23:00,"13543 Greenwood Ave N, Seattle, Wa",2495.0,Spacious living room with in home washer and dryer!,https://seattle.craigslist.org/see/apa/d/seattle-spacious-living-room-with-in/7521915241.html,2.0,1100.0
2022-08-17 20:23:00,"2226 Elliott Ave, Seattle, Wa",3670.0,"Your 2BR 2BA apt awaits, Modern kitchen, Walk-in closet, Belltown area",https://seattle.craigslist.org/see/apa/d/seattle-your-2br-2ba-apt-awaits-modern/7517439198.html,2.0,900.0
2022-08-17 20:22:00,"2619 5Th Avenue, Seattle, Wa",1499.0,"Plush Carpet, Non-Smoking Building, Walk-In Closets",https://seattle.craigslist.org/see/apa/d/seattle-plush-carpet-non-smoking/7522792982.html,,359.0
2022-08-17 20:21:00,"308 4Th Ave S , Seattle-Tacoma, Wa",1359.0,"On-Site Management, Elevator, Vintage Moldings",https://seattle.craigslist.org/see/apa/d/seattle-on-site-management-elevator/7522792726.html,,128.0
2022-08-17 20:17:00,"2226 Elliott Ave, Seattle, Wa",2950.0,"Fun, Unique floor plan! 2BR 2BA apt, Plenty storage, Modern kitchen",https://seattle.craigslist.org/see/apa/d/seattle-fun-unique-floor-plan-2br-2ba/7522791911.html,2.0,975.0
2022-08-17 20:15:00,"3231 S 204Th St, Seatac, Wa",1875.0,"Flexible Monthly Payments with Flex Rent, Electric Range, Ceiling Fan",https://seattle.craigslist.org/see/apa/d/seattle-flexible-monthly-payments-with/7522791577.html,2.0,900.0
2022-08-17 20:09:00,"2619 5Th Avenue, Seattle, Wa",1449.0,"New Dark Cherry Cabinets, Internet Ready, Plush Carpet",https://seattle.craigslist.org/see/apa/d/seattle-new-dark-cherry-cabinets/7521940008.html,,410.0
2022-08-17 20:04:00,"905 Dexter Ave N, Seattle, Wa",2593.0,East Facing Spacious Urban Bedroom!!,https://seattle.craigslist.org/see/apa/d/seattle-east-facing-spacious-urban/7518603596.html,1.0,679.0
2022-08-17 19:59:00,Kent,1548.0,"Patio, Free Bike Storage, Stainless Steel Appliances",https://seattle.craigslist.org/see/apa/d/seattle-patio-free-bike-storage/7520261264.html,,500.0
2022-08-17 19:49:00,Queen Anne,2800.0,Queen Anne Studio Condo for Rent,https://seattle.craigslist.org/see/apa/d/seattle-queen-anne-studio-condo-for-rent/7522786673.html,,
2022-08-17 19:46:00,"308 4Th Ave S , Seattle-Tacoma, Wa",1359.0,"Close to Public Transportation, Dishwasher, Historic Building",https://seattle.craigslist.org/see/apa/d/seattle-close-to-public-transportation/7520372588.html,,128.0
2022-08-17 19:40:00,"14700 Ne 35Th St, Bellevue, Wa",2650.0,"Open concept living!! Ideal 2BR 1BA apt, Bellevue area, Modern kitchen",https://seattle.craigslist.org/see/apa/d/bellevue-open-concept-living-ideal-2br/7520761647.html,2.0,950.0
2022-08-17 19:33:00,Green Lake,2055.0,Spacious 1x1 with Washer/Dryer in Every Home! Lots of Natural Light,https://seattle.craigslist.org/see/apa/d/seattle-spacious-1x1-with-washer-dryer/7522783309.html,1.0,626.0
2022-08-17 19:28:00,Cedar Park,2487.0,3BD 2 BTH duplex. Most utilities included.,https://seattle.craigslist.org/see/apa/d/seattle-3bd-bth-duplex-most-utilities/7517823748.html,3.0,1225.0
2022-08-17 19:26:00,"3490 Sw Graham St, Seattle-Tacoma, Wa",1895.0,1 bedroom 1 bath - Parking Garage - Pet Friendly and Luxurious Home,https://seattle.craigslist.org/see/apa/d/seattle-bedroom-bath-parking-garage-pet/7513414693.html,1.0,705.0
2022-08-17 19:21:00,"3231 S 204Th St, Seatac, Wa",1875.0,"Wood Burning Fireplace, Stainless Steel Appliances, Large Closets",https://seattle.craigslist.org/see/apa/d/seattle-wood-burning-fireplace/7522780789.html,2.0,900.0
2022-08-17 19:20:00,Spring District,2726.0,"Berber carpet and vinyl plank flooring, Public courtyard, Event space",https://seattle.craigslist.org/see/apa/d/bellevue-berber-carpet-and-vinyl-plank/7522780711.html,1.0,652.0
2022-08-17 19:15:00,"400 S Jackson Street  , Seattle, Wa",1907.0,"2 Weeks FREE! Pet Friendly, Plank Floors, Stadium Views",https://seattle.craigslist.org/see/apa/d/seattle-weeks-free-pet-friendly-plank/7517281024.html,1.0,536.0
2022-08-17 19:12:00,Queen Anne Ballard Fremont Seattle Downtown Seattle,1350.0,QUEEN ANNE! SUPER CUTE SPACIOUS STUDIO! HARDWOOD! FANTASTIC LOCATION!!,https://seattle.craigslist.org/see/apa/d/seattle-queen-anne-super-cute-spacious/7520997079.html,,500.0
2022-08-17 19:11:00,"308 4Th Ave S , Seattle-Tacoma, Wa",1456.0,"Convection oven/Microwaves and Dishwashers, Laundry Facility, Elevator",https://seattle.craigslist.org/see/apa/d/seattle-convection-oven-microwaves-and/7522778654.html,1.0,132.0
2022-08-17 19:10:00,Seattle,1350.0,"Near by Seattle Center-Lower Queen Anne, One  Bedroom",https://seattle.craigslist.org/see/apa/d/seattle-near-by-seattle-center-lower/7522778454.html,1.0,425.0
2022-08-17 19:07:00,"2226 Elliott Ave, Seattle, Wa",3670.0,"Must see 2BR apt, Belltown/Elliott Bay, Modern kitchen, Light & bright",https://seattle.craigslist.org/see/apa/d/seattle-must-see-2br-apt-belltown/7522777629.html,2.0,900.0
2022-08-17 19:06:00,"308 4Th Ave S , Seattle-Tacoma, Wa",1359.0,"Dishwasher, Fitness Center, Close to Freeway",https://seattle.craigslist.org/see/apa/d/seattle-dishwasher-fitness-center-close/7521924154.html,,128.0
2022-08-17 19:03:00,"521 Stadium Place S, Seattle, Wa",1812.0,"Seattle Views, Air Conditioning, Washer and Dryer",https://seattle.craigslist.org/see/apa/d/seattle-seattle-views-air-conditioning/7521054789.html,,501.0
2022-08-17 18:59:00,"521 Stadium Place S, Seattle, Wa",2237.0,"Air Conditioning, Water Views, Private Patios,  High-End Finishes",https://seattle.craigslist.org/see/apa/d/seattle-air-conditioning-water-views/7522775667.html,1.0,591.0
2022-08-17 18:51:00,Puyallup,1577.0,Love where you live,https://seattle.craigslist.org/see/apa/d/sumner-love-where-you-live/7522773877.html,1.0,861.0
2022-08-17 18:51:00,"25102 62Nd Avenue South, Kent, Wa",2196.0,Amazing opportunity to live here in Signature Pointe!,https://seattle.craigslist.org/see/apa/d/seattle-amazing-opportunity-to-live/7522773679.html,2.0,915.0
2022-08-17 18:50:00,"Seattle, Downtown",4228.0,Everything youâ€™ve been dreaming of is here. Lease today!,https://seattle.craigslist.org/see/apa/d/seattle-everything-youve-been-dreaming/7522741917.html,2.0,1169.0
2022-08-17 18:49:00,Mercer Island,6485.0,This beautiful 2bd/2ba has everything your looking for! Tour Today!,https://seattle.craigslist.org/see/apa/d/mercer-island-this-beautiful-2bd-2ba/7522773327.html,2.0,2072.0
2022-08-17 18:46:00,Queen Anne,3036.0,Instagram-worthy views | Modern finishes | Private balconies!,https://seattle.craigslist.org/see/apa/d/seattle-instagram-worthy-views-modern/7522766770.html,2.0,861.0
2022-08-17 18:43:00,"Seattle, Wa",2250.0,121 12th Ave E Unit 506,https://seattle.craigslist.org/see/apa/d/seattle-th-ave-unit-506/7522768435.html,1.0,
2022-08-17 18:39:00,Seattle-Leschi,1895.0,Leschi-Lake Washington Waterfront,https://seattle.craigslist.org/see/apa/d/seattle-leschi-lake-washington/7522770180.html,1.0,675.0
2022-08-17 18:39:00,"2619 5Th Avenue, Seattle, Wa",1499.0,"New Dark Cherry Cabinets, Cable Ready, Marble Flooring in Bathroom",https://seattle.craigslist.org/see/apa/d/seattle-new-dark-cherry-cabinets-cable/7522770666.html,,359.0
2022-08-17 18:38:00,"2510 Western Avenue, Suite 100 , Seattle, Wa",1399.0,"Walk-In Closets, Translation Service Available, Courtyard",https://seattle.craigslist.org/see/apa/d/seattle-walk-in-closets-translation/7519498250.html,,444.0
2022-08-17 18:36:00,"10321 Meridian Ave N, Seattle, Wa",1525.0,"Secure Building, Garage Parking, Dishwasher",https://seattle.craigslist.org/see/apa/d/seattle-secure-building-garage-parking/7521891851.html,1.0,570.0
2022-08-17 18:33:00,"1820 Minor Ave , Seattle, Wa",1379.0,"Controlled Access/Gated, Carpeting, Refrigerator",https://seattle.craigslist.org/see/apa/d/seattle-controlled-access-gated/7521112642.html,,344.0
2022-08-17 18:31:00,Seattle,3048.0,"Loft w/patio, natural lighting, washer & dryer, 1st Hill,",https://seattle.craigslist.org/see/apa/d/seattle-loft-patio-natural-lighting/7522768821.html,1.0,878.0
2022-08-17 18:29:00,"255 Lenora St, Seattle, Wa",5608.0,20 Feet Floor to Ceiling Windows in This Modern 2-Story Loft!,https://seattle.craigslist.org/see/apa/d/seattle-20-feet-floor-to-ceiling/7517830416.html,1.0,1111.0
2022-08-17 18:28:00,Lake City/Shoreline/Cedar Park,1497.0,Studio Ready To Call Home 2nd Floor Full Size Appliances,https://seattle.craigslist.org/see/apa/d/seattle-studio-ready-to-call-home-2nd/7522768122.html,,499.0
2022-08-17 18:27:00,"3231 S 204Th St, Seatac, Wa",1875.0,***Zero Deposit; close to light rail; free assigned carport!!,https://seattle.craigslist.org/see/apa/d/seattle-zero-deposit-close-to-light/7522767659.html,2.0,900.0
2022-08-17 18:22:00,"604 E Union St, Seattle, Wa",1400.0,"Hardwood Floors, Crown Molding, Garage Parking",https://seattle.craigslist.org/see/apa/d/seattle-hardwood-floors-crown-molding/7522766437.html,,538.0
2022-08-17 18:21:00,Seattle,4800.0,Walking Distance to many stores and employers nearby- 6wks FREE LMTEDx,https://seattle.craigslist.org/see/apa/d/seattle-walking-distance-to-many-stores/7522766167.html,1.0,1282.0
2022-08-17 18:21:00,Seattle,2620.0,"One Bedroom in South Lake Union, Steps from the Lake",https://seattle.craigslist.org/see/apa/d/seattle-one-bedroom-in-south-lake-union/7522766147.html,1.0,705.0
2022-08-17 18:20:00,"2510 Western Avenue, Suite 100 , Seattle, Wa",1489.0,"Flexible Monthly Payments with Flex Rent, Courtyard, Intercom Access",https://seattle.craigslist.org/see/apa/d/seattle-flexible-monthly-payments-with/7522766047.html,,444.0
2022-08-17 18:19:00,"308 4Th Ave S , Seattle-Tacoma, Wa",1359.0,"Walk-In Shower, Controlled Access/Gated, Laundry Facility",https://seattle.craigslist.org/see/apa/d/seattle-walk-in-shower-controlled/7522765699.html,,186.0
2022-08-17 18:19:00,Downtown Seattle,2740.0,"Storage Units, Mountain, sound & skyline views, Open-Concept Layout",https://seattle.craigslist.org/see/apa/d/seattle-storage-units-mountain-sound/7522765598.html,1.0,727.0
2022-08-17 18:18:00,"915 E Spruce St, Seattle, Wa",2195.0,"Top Floor Corner Apt - Modern Construction, Beautiful Views!",https://seattle.craigslist.org/see/apa/d/seattle-top-floor-corner-apt-modern/7519400754.html,1.0,540.0
2022-08-17 18:17:00,Seattle,1795.0,"Secured Garage Parking, Elevator, Secured Entry",https://seattle.craigslist.org/see/apa/d/seattle-secured-garage-parking-elevator/7517267444.html,1.0,677.0
2022-08-17 18:17:00,"1321 Minor Ave, Seattle, Wa",1995.0,1BR 1BA apt | In-home Washer/Dryer | First Hill area | Modern kitchen,https://seattle.craigslist.org/see/apa/d/seattle-1br-1ba-apt-in-home-washer/7517445485.html,1.0,647.0
2022-08-17 18:16:00,"Seattle, Capitol Hill",2650.0,"Living in Captial Hil w/ This Beautiful, Cozy, Corner 1x1",https://seattle.craigslist.org/see/apa/d/seattle-living-in-captial-hil-this/7522762158.html,1.0,696.0
2022-08-17 18:16:00,Seattle,3011.0,"California Closets in every home, Patios*, Great room",https://seattle.craigslist.org/see/apa/d/seattle-california-closets-in-every/7522764919.html,1.0,620.0
2022-08-17 18:15:00,Seattle,3990.0,"Breathtaking views of the City, floor to ceiling windows w/ 6WKS FREE",https://seattle.craigslist.org/see/apa/d/seattle-breathtaking-views-of-the-city/7522764691.html,1.0,1282.0
2022-08-17 18:14:00,"2226 Elliott Ave, Seattle, Wa",2150.0,"Belltown 1BR apt has Washer/Dryer, Stainless kitchen, Generous storage",https://seattle.craigslist.org/see/apa/d/seattle-belltown-1br-apt-has-washer/7522764543.html,1.0,700.0
2022-08-17 18:13:00,1532 Ne 21St Avenue,1399.0,GET OUR NEW LOW PRICE! .. Cook's Kitchen Island plus New Appliances,https://seattle.craigslist.org/see/apa/d/portland-get-our-new-low-price-cooks/7517147361.html,1.0,
