Post_Date,Neighborhood,Price,Title,Url,Bedroom,sqft
2022-08-18 15:24:00,"Seattle, Wa",1495.0,We are a new building located in Queen Anne! Natural Light in Unit!,https://seattle.craigslist.org/see/apa/d/seattle-we-are-new-building-located-in/7523117934.html,,320.0
2022-08-18 15:23:00,"14700 Ne 35Th St, Bellevue, Wa",2750.0,"2BR Town Home, Modern kitchen, Tons of storage, Large 2-story plan",https://seattle.craigslist.org/see/apa/d/bellevue-2br-town-home-modern-kitchen/7523122318.html,2.0,1057.0
2022-08-18 15:23:00,"2619 5Th Avenue, Seattle, Wa",1499.0,"Walk-In Closets, Cable Ready, Old World Charm Crown Molding",https://seattle.craigslist.org/see/apa/d/seattle-walk-in-closets-cable-ready-old/7522251125.html,,359.0
2022-08-18 15:23:00,Seattle,1848.0,"Heated Indoor Pool, Sauna, & Spa, Separate Dining Room, Double Sinks",https://seattle.craigslist.org/see/apa/d/seattle-heated-indoor-pool-sauna-spa/7523121994.html,1.0,700.0
2022-08-18 15:22:00,Seattle,2804.0,"Call for Details, Catering Kitchen, Ceramic Tile",https://seattle.craigslist.org/see/apa/d/call-for-details-catering-kitchen/7523121893.html,1.0,701.0
2022-08-18 15:22:00,"3490 Sw Graham St, Seattle-Tacoma, Wa",2105.0,Move into this spacious 1 bedroom! $500 Move In Special,https://seattle.craigslist.org/see/apa/d/seattle-move-into-this-spacious-bedroom/7523121698.html,1.0,749.0
2022-08-18 15:22:00,"1100 University St Seattle, Wa",3272.0,***98 Walking Score! Spacious Floor Plan! Washer/dryer in HOME!,https://seattle.craigslist.org/see/apa/d/seattle-98-walking-score-spacious-floor/7523121661.html,2.0,1134.0
2022-08-18 15:22:00,"255 Lenora St, Seattle, Wa",5951.0,Hospitality& Service You Can't Find Anywhere Else! Only At The Modern.,https://seattle.craigslist.org/see/apa/d/seattle-hospitality-service-you-cant/7523121566.html,2.0,1178.0
2022-08-18 15:21:00,"Seattle, Green Lake, Roosevelt",2392.0,Private Patio with a View of MT. Rainer + $1000 off September Rent,https://seattle.craigslist.org/see/apa/d/seattle-private-patio-with-view-of-mt/7523121285.html,1.0,650.0
2022-08-18 15:20:00,"8026 15Th Avenue Northwest, Seattle-Tacoma, Wa",1745.0,"Bicycle Storage, Harwood/Vinyl Floors, Secured Garage Parking",https://seattle.craigslist.org/see/apa/d/seattle-bicycle-storage-harwood-vinyl/7523116688.html,1.0,558.0
2022-08-18 15:17:00,"Seattle, South Lake Union, Denny Triangle, Westlake",3202.0,Newly Reduced Rents & 8 WEEKS FREE! Check out REN today!,https://seattle.craigslist.org/see/apa/d/seattle-newly-reduced-rents-weeks-free/7523119602.html,1.0,700.0
2022-08-18 15:17:00,"Interbay, Seattle",2270.0,Open One Bedroom w/ Large Kitchen!,https://seattle.craigslist.org/see/apa/d/seattle-open-one-bedroom-large-kitchen/7523119576.html,1.0,730.0
2022-08-18 15:17:00,Chinatown/International District,850.0,Dorm Style Student Housing Available Now!!,https://seattle.craigslist.org/see/apa/d/seattle-dorm-style-student-housing/7519848007.html,1.0,
2022-08-18 15:16:00,Seattle / Fremont / Wallingford,3014.0,Live in style at the Prescott Wallingford Apartments!,https://seattle.craigslist.org/see/apa/d/seattle-live-in-style-at-the-prescott/7523119436.html,2.0,815.0
2022-08-18 15:16:00,Queen Anne,1970.0,"Green Apartment, Pet Friendly, Controlled Access",https://seattle.craigslist.org/see/apa/d/seattle-green-apartment-pet-friendly/7523119422.html,,654.0
2022-08-18 15:16:00,Seattle,4737.0,Live Like You Want. Thatâ€™s Our Anthem.,https://seattle.craigslist.org/see/apa/d/seattle-live-like-you-want-thats-our/7523119402.html,2.0,1593.0
2022-08-18 15:16:00,Burien,2033.0,The Lifestyle you deserve!,https://seattle.craigslist.org/see/apa/d/seattle-the-lifestyle-you-deserve/7523116423.html,2.0,897.0
2022-08-18 15:16:00,Mercer Island,2118.0,1 Month FREE! One Bedroom Available Now! Visit Us On Mercer Island!!,https://seattle.craigslist.org/see/apa/d/mercer-island-month-free-one-bedroom/7523119332.html,1.0,663.0
2022-08-18 15:15:00,Mercer Island,3549.0,Enjoy Peaceful Living on Mercer Island,https://seattle.craigslist.org/see/apa/d/mercer-island-enjoy-peaceful-living-on/7523118807.html,2.0,1071.0
2022-08-18 15:14:00,Seattle,2900.0,"New tile backsplash, Rooftop Dog Park and view of the Space Needle!",https://seattle.craigslist.org/see/apa/d/seattle-new-tile-backsplash-rooftop-dog/7523118615.html,2.0,722.0
2022-08-18 15:14:00,Capitol Hill,1641.0,MFTE 1-Bed Unit with AC. 75% AMI,https://seattle.craigslist.org/see/apa/d/seattle-mfte-bed-unit-with-ac-75-ami/7516106787.html,1.0,525.0
2022-08-18 15:14:00,Capitol Hill,2225.0,"1-Bedroom with AC, Huge Patio in Amenitized Building!",https://seattle.craigslist.org/see/apa/d/seattle-bedroom-with-ac-huge-patio-in/7516095377.html,1.0,509.0
2022-08-18 15:14:00,Uptown,2985.0,"2-Bed/2-Bath with Balcony, Walk In Closet",https://seattle.craigslist.org/see/apa/d/seattle-bed-bath-with-balcony-walk-in/7511220637.html,2.0,974.0
2022-08-18 15:13:00,"Roosevelt, Seattle",2300.0,One Bedroom Home Near EVERYTHNG You Need!,https://seattle.craigslist.org/see/apa/d/seattle-one-bedroom-home-near-everythng/7523109899.html,1.0,528.0
2022-08-18 15:11:00,Fremont/Wallingford,2450.0,"Sunny, private, super cute. Mid-century gem in Fremont",https://seattle.craigslist.org/see/apa/d/seattle-sunny-private-super-cute-mid/7523117328.html,2.0,780.0
2022-08-18 15:09:00,"Bothell, Wa",2095.0,â€¢ Yoga Studio with Virtual Fitness Classes,https://seattle.craigslist.org/see/apa/d/bothell-yoga-studio-with-virtual/7523116349.html,1.0,581.0
2022-08-18 15:08:00,Seattle,2050.0,"$500 Off! Cool Apartments, Hot Location. Come Tour Today!",https://seattle.craigslist.org/see/apa/d/seattle-500-off-cool-apartments-hot/7523115916.html,,519.0
2022-08-18 15:08:00,South Seattle,0.0,Looking to move in the future! We have a waiting list!,https://seattle.craigslist.org/see/apa/d/seattle-looking-to-move-in-the-future/7523115906.html,,
2022-08-18 15:08:00,Capitol Hill,1795.0,SWANSONIAâ–º2nd FLOOR FULL REMODEL! Hardwoods! W/D in unit!,https://seattle.craigslist.org/see/apa/d/seattle-swansonia2nd-floor-full-remodel/7523115800.html,1.0,500.0
2022-08-18 15:07:00,"Ravenna, Roosevelt, Green Lake, Bryant",2595.0,"SAXEâ–º2BD/1BA Modern! Plank Floors! W/D, 3rd Floor, Cats/Dogs Ok!",https://seattle.craigslist.org/see/apa/d/seattle-saxe2bd-1ba-modern-plank-floors/7523115653.html,2.0,915.0
2022-08-18 15:06:00,"11301 3Rd Ave Ne , Seattle, Wa",2205.0,"Walking distance to Shopping, Restaurants, Light rail station & park",https://seattle.craigslist.org/see/apa/d/seattle-walking-distance-to-shopping/7523115283.html,1.0,674.0
2022-08-18 15:06:00,Seattle,2217.0,Beautiful Corner Studio High Ceiling with Walk in Closet,https://seattle.craigslist.org/see/apa/d/seattle-beautiful-corner-studio-high/7523115108.html,,511.0
2022-08-18 15:06:00,Seattle,1939.0,Amazing 1bed 1bath home!! Pet friendly! and no smoking!,https://seattle.craigslist.org/see/apa/d/seattle-amazing-1bed-1bath-home-pet/7523115065.html,1.0,555.0
2022-08-18 15:06:00,Seattle,2636.0,"Townhouse units, On-site retail, Elevators",https://seattle.craigslist.org/see/apa/d/seattle-townhouse-units-on-site-retail/7523115068.html,1.0,
2022-08-18 15:06:00,Seattle - Denny Triangle,2705.0,There's no place like home at Kinects Tower!,https://seattle.craigslist.org/see/apa/d/seattle-theres-no-place-like-home-at/7523095608.html,1.0,658.0
2022-08-18 15:05:00,Seattle,2790.0,One Bedroom in the Heart of the Hill!,https://seattle.craigslist.org/see/apa/d/seattle-one-bedroom-in-the-heart-of-the/7523114775.html,1.0,735.0
2022-08-18 15:04:00,Capitol Hill,1395.0,ROOSEVELT APTSâ–º TOP Floor STUDIO! Hardwoods! Cats ok!,https://seattle.craigslist.org/see/apa/d/seattle-roosevelt-apts-top-floor-studio/7523114192.html,,500.0
2022-08-18 15:03:00,Capitol Hill,1850.0,"ORIANA APTSâ–ºHardwoods, vintage charm+updates, granite, PARKING!",https://seattle.craigslist.org/see/apa/d/seattle-oriana-aptshardwoods-vintage/7523113858.html,1.0,730.0
2022-08-18 15:01:00,Seattle,1475.0,Affordable Studio in lower Queen Anne,https://seattle.craigslist.org/see/apa/d/seattle-affordable-studio-in-lower/7523113029.html,1.0,525.0
2022-08-18 15:01:00,Green Lake,1250.0,Beautiful apartment with 12 month special,https://seattle.craigslist.org/see/apa/d/seattle-beautiful-apartment-with-12/7523065086.html,1.0,463.0
2022-08-18 15:01:00,Seattle,2189.0,"Outdoor Pool & Spa, Outdoor BBQs & Firepits, Microwave",https://seattle.craigslist.org/see/apa/d/seattle-outdoor-pool-spa-outdoor-bbqs/7523112784.html,2.0,915.0
2022-08-18 15:00:00,Northgate Pinehurst North Seattle,1395.0,"NORTHGATE VIEW APTSâ–º Top Floor 1BD, Deck, Parking Walk to Light Rail",https://seattle.craigslist.org/see/apa/d/seattle-northgate-view-apts-top-floor/7523112661.html,1.0,750.0
2022-08-18 14:58:00,Lower Queen Anne,1963.0,"Electric Car Charging Stations, Dog Spa, Contemporary cabinetry",https://seattle.craigslist.org/see/apa/d/seattle-electric-car-charging-stations/7523111897.html,,478.0
2022-08-18 14:58:00,"9Th Avenue Ne Shoreline, Wa",1040.0,Bright 3 bedroom rambler located in the desirable North City,https://seattle.craigslist.org/see/apa/d/seattle-bright-bedroom-rambler-located/7523107601.html,3.0,1010.0
2022-08-18 14:57:00,Seattle,1848.0,"Outdoor BBQs & Firepits, Separate Dining Room, Built-In Bookshelves",https://seattle.craigslist.org/see/apa/d/seattle-outdoor-bbqs-firepits-separate/7523111486.html,1.0,700.0
2022-08-18 14:56:00,Lower Queen Anne / Uptown,2150.0,"Amazing, Remodeled 2-Bedroom Corner Apartment!",https://seattle.craigslist.org/see/apa/d/seattle-amazing-remodeled-bedroom/7523111145.html,2.0,685.0
2022-08-18 14:56:00,Northgate,1862.0,Walk To NSC & The Northgate Link!,https://seattle.craigslist.org/see/apa/d/seattle-walk-to-nsc-the-northgate-link/7523110859.html,1.0,565.0
2022-08-18 14:55:00,Crown Hill / Ballard / Greenwood,1595.0,"IMPERIAL CROWN MANORâ–º Parking, Deck, Remodeled kitchen/bath",https://seattle.craigslist.org/see/apa/d/seattle-imperial-crown-manor-parking/7523109492.html,2.0,800.0
2022-08-18 14:54:00,Seattle,4194.0,"Recycling, Open-Concept, Yoga Studio",https://seattle.craigslist.org/see/apa/d/seattle-recycling-open-concept-yoga/7523110300.html,2.0,927.0
2022-08-18 14:54:00,Crown Hill / Ballard / Greenwood,1395.0,"IMPERIAL CROWN MANORâ–º 2bd Floor REMODELED Kitchen/Bath, Deck",https://seattle.craigslist.org/see/apa/d/seattle-imperial-crown-manor-2bd-floor/7523110280.html,1.0,540.0
2022-08-18 14:53:00,Seattle,1866.0,"Top Floor Units Feature 19-ft Ceilings, Outdoor Pool & Spa, Microwave",https://seattle.craigslist.org/see/apa/d/seattle-top-floor-units-feature-19-ft/7520646483.html,1.0,700.0
2022-08-18 14:53:00,Kent,1437.0,"Wood Look Flooring, Clubhouse, Dishwasher",https://seattle.craigslist.org/see/apa/d/seattle-wood-look-flooring-clubhouse/7519791378.html,,500.0
2022-08-18 14:52:00,Seattle,2695.0,#1101 - Bright & Sunny Studio With Beautiful Space Needle Views!,https://seattle.craigslist.org/see/apa/d/seattle-bright-sunny-studio-with/7523109491.html,,520.0
2022-08-18 14:52:00,Seattle,1350.0,"Corner Unit, Private Entrance & Walk-In Closet - 2 Weeks Free",https://seattle.craigslist.org/see/apa/d/seattle-corner-unit-private-entrance/7522237991.html,,440.0
2022-08-18 14:52:00,Seattle,1359.0,"On-Site Management, Microwave, Close to Restaurants",https://seattle.craigslist.org/see/apa/d/seattle-on-site-management-microwave/7520258739.html,,186.0
2022-08-18 14:52:00,Seattle,2689.0,Love where you live! Ideal Ravenna Location!,https://seattle.craigslist.org/see/apa/d/seattle-love-where-you-live-ideal/7523109407.html,1.0,
2022-08-18 14:51:00,Seattle,1703.0,"Storage Units, Microwave, Two Indoor Pool Cabanas",https://seattle.craigslist.org/see/apa/d/seattle-storage-units-microwave-two/7523108821.html,1.0,586.0
2022-08-18 14:50:00,Seattle,3200.0,"#1207 - Brand New, Tons of Storage, Luxury Finishes!",https://seattle.craigslist.org/see/apa/d/seattle-brand-new-tons-of-storage/7523108555.html,1.0,785.0
2022-08-18 14:49:00,Capitol Hill,1995.0,"JOHN COURTâ–ºHUGE Courtyard, Plank Floors, Cats/Dogs ok! Garage parking!",https://seattle.craigslist.org/see/apa/d/seattle-john-courthuge-courtyard-plank/7523107978.html,1.0,688.0
2022-08-18 14:49:00,Seattle,3380.0,#1106 - Spacious Traditional Luxury Home With Lots of Natural Light!,https://seattle.craigslist.org/see/apa/d/seattle-spacious-traditional-luxury/7523107952.html,1.0,792.0
2022-08-18 14:48:00,Seattle,3739.0,Renovated 2-Bedroom Apartment Next to Queen Anne's Farmer's Market!,https://seattle.craigslist.org/see/apa/d/seattle-renovated-bedroom-apartment/7523107542.html,2.0,1009.0
2022-08-18 14:48:00,"14700 Ne 35Th St, Bellevue, Wa",2650.0,"Modern kitchen, 2BR 1BA apt in Bellevue, W/D inside, Private patio",https://seattle.craigslist.org/see/apa/d/bellevue-modern-kitchen-2br-1ba-apt-in/7523107472.html,2.0,950.0
2022-08-18 14:45:00,Spring District,2812.0,"Custom pendant lights in kitchen, Well-stocked fitness center",https://seattle.craigslist.org/see/apa/d/bellevue-custom-pendant-lights-in/7523106481.html,1.0,750.0
2022-08-18 14:45:00,South Lake Union,8160.0,Urban Energy. Sky High Decadence.,https://seattle.craigslist.org/see/apa/d/seattle-urban-energy-sky-high-decadence/7523106184.html,2.0,1748.0
2022-08-18 14:44:00,"Ballard, Seattle",2395.0,Private Entry! Two Bedroom/One Bath Available in Ballard*,https://seattle.craigslist.org/see/apa/d/seattle-private-entry-two-bedroom-one/7523106047.html,2.0,1000.0
2022-08-18 14:44:00,Ballard,2250.0,"2 Bed, 1 Bath Ballard #A $2250.00",https://seattle.craigslist.org/see/apa/d/seattle-bed-bath-ballard/7519894841.html,2.0,900.0
2022-08-18 14:41:00,Alki,1183.0,1-Bedroom near Alki Beach w/special,https://seattle.craigslist.org/see/apa/d/seattle-bedroom-near-alki-beach-special/7523098952.html,1.0,328.0
2022-08-18 14:41:00,"Belltown, Seattle",2865.0,"Fabulous Loft Living In Belltown! 1x1! Water Views, Balcony, & A/C!",https://seattle.craigslist.org/see/apa/d/seattle-fabulous-loft-living-in/7523104812.html,1.0,666.0
2022-08-18 14:40:00,Renton - 15 Minute Drive To Kubota Gardens,2476.0,Simply breath-taking! Amazing views at 2000 Lake Washington Apartments,https://seattle.craigslist.org/see/apa/d/renton-simply-breath-taking-amazing/7523104497.html,2.0,889.0
2022-08-18 14:40:00,Lake City/Shoreline/Cedar Park,1976.0,5Th Floor 1x1 Large Patio Walk In Closet Visit Today,https://seattle.craigslist.org/see/apa/d/seattle-5th-floor-1x1-large-patio-walk/7523104341.html,1.0,677.0
2022-08-18 14:39:00,Seattle,2455.0,"Amazon Hub - Package Lockers, Carpeting, Business Center",https://seattle.craigslist.org/see/apa/d/seattle-amazon-hub-package-lockers/7523103855.html,1.0,700.0
2022-08-18 14:36:00,"Belltown, Seattle",3002.0,Tremendous Views Of The Sound In Your Belltown 1x1! Balcony & A/C!,https://seattle.craigslist.org/see/apa/d/seattle-tremendous-views-of-the-sound/7523102870.html,1.0,665.0
2022-08-18 14:36:00,Seattle,2327.0,"Controlled Access, Close to Freeway, Extra-large closets",https://seattle.craigslist.org/see/apa/d/seattle-controlled-access-close-to/7519267681.html,1.0,448.0
2022-08-18 14:36:00,Kent,1799.0,"Full-Size Washer & Dryer*, Private Balcony or Patio",https://seattle.craigslist.org/see/apa/d/seattle-full-size-washer-dryer-private/7523102725.html,2.0,891.0
2022-08-18 14:35:00,"337 Ne 103Rd Street Seattle, Wa",1995.0,Large Studio Steps Away from Kraken Iceplex ðŸ¤©,https://seattle.craigslist.org/see/apa/d/seattle-large-studio-steps-away-from/7523096808.html,,589.0
2022-08-18 14:35:00,Seattle,2250.0,"Serene Living, Southern exposure, Walk to Downtown Winslow",https://seattle.craigslist.org/see/apa/d/bainbridge-island-serene-living/7523102371.html,2.0,1130.0
2022-08-18 14:35:00,East Lake/South Lake Union/Seattle/Downtown/Amazon,3100.0,1 Bedroom + Den Available in the Eastlake Area!,https://seattle.craigslist.org/see/apa/d/seattle-bedroom-den-available-in-the/7523093823.html,1.0,945.0
2022-08-18 14:32:00,Wallingford,3980.0,Brand New 2BD/2BTH with Special On Top of Market Price!,https://seattle.craigslist.org/see/apa/d/seattle-brand-new-2bd-2bth-with-special/7523084003.html,2.0,1086.0
2022-08-18 14:32:00,"7805 170Th Pl Ne Redmond, Wa",1656.0,Top floor studio in Downtown Redmond!,https://seattle.craigslist.org/see/apa/d/redmond-top-floor-studio-in-downtown/7523101033.html,,533.0
2022-08-18 14:32:00,Seattle Ne- View Ridge/Sandpoint/Wedgood,2395.0,2BD/1BA-FULLY FURNISHED apt. MIL/Sandpoint Golf Club/NEAR UW - Aug 29,https://seattle.craigslist.org/see/apa/d/seattle-2bd-1ba-fully-furnished-apt-mil/7522104161.html,2.0,1200.0
2022-08-18 14:32:00,"21212 International Boulevard Seatac, Wa",1693.0,GREAT PLACE TO LIVE-Designed with Seniors in Mind,https://seattle.craigslist.org/see/apa/d/kent-great-place-to-live-designed-with/7523100822.html,2.0,715.0
2022-08-18 14:31:00,Capitol Hill- Seattle- Downtown Seattle,2195.0,Spacious studio with gorgeous views! Get the best natural lighting!,https://seattle.craigslist.org/see/apa/d/seattle-spacious-studio-with-gorgeous/7520243476.html,1.0,555.0
2022-08-18 14:31:00,Renton - 15 Minute Drive To Kubota Gardens,2028.0,"Let us show you the home of your dreams! Tour our 1 Bed, 1 bath!",https://seattle.craigslist.org/see/apa/d/renton-let-us-show-you-the-home-of-your/7523100626.html,1.0,650.0
2022-08-18 14:31:00,Capitol Hill- Seattle- Rooftop- Gym,2495.0,Large 1 bedroom available NOW!,https://seattle.craigslist.org/see/apa/d/seattle-large-bedroom-available-now/7520273617.html,1.0,693.0
2022-08-18 14:31:00,Cap Hill Apartment!,2195.0,Pet-Friendly Studio With Gorgeous Views 4 weeks free!,https://seattle.craigslist.org/see/apa/d/seattle-pet-friendly-studio-with/7520301430.html,,415.0
2022-08-18 14:30:00,Capitol Hill ~ Downtown ~ Seattle,2200.0,The perfect 1x1+ den available now! AC units for rent!,https://seattle.craigslist.org/see/apa/d/seattle-the-perfect-1x1-den-available/7520529430.html,1.0,589.0
2022-08-18 14:29:00,Four Weeks Free!! Lower Your Rent For 12 Months!!,2562.0,City view with floor to ceiling windows!,https://seattle.craigslist.org/see/apa/d/seattle-city-view-with-floor-to-ceiling/7520537830.html,1.0,589.0
2022-08-18 14:29:00,Capitol Hill,1829.0,City view studio! Tour today!,https://seattle.craigslist.org/see/apa/d/seattle-city-view-studio-tour-today/7520561521.html,,446.0
2022-08-18 14:29:00,"Seattle, Lake City",1495.0,"Stunning 1x1 with spacious living room, Laundry facility onsite & more",https://seattle.craigslist.org/see/apa/d/seattle-stunning-1x1-with-spacious/7523099796.html,1.0,675.0
2022-08-18 14:29:00,Seattle,630.0,Available September 1st-Lovely 1bedroom apt in Seattle,https://seattle.craigslist.org/see/apa/d/seattle-available-september-1st-lovely/7523097531.html,1.0,
2022-08-18 14:29:00,Huge Windows~ Spacious Windows~ Paramount~ Cap Hill,2395.0,Spacios studio with floor to ceiling windows available NOW!,https://seattle.craigslist.org/see/apa/d/seattle-spacios-studio-with-floor-to/7520526585.html,,555.0
2022-08-18 14:29:00,"337 Ne 103Rd Street Seattle, Wa",2195.0,ðŸŒ² Tranquil Creekside Studio!,https://seattle.craigslist.org/see/apa/d/seattle-tranquil-creekside-studio/7523097953.html,,605.0
2022-08-18 14:28:00,"1208 Pine St Seattle, Wa #517",2250.0,Sip your morning coffee from this perfect balcony!,https://seattle.craigslist.org/see/apa/d/seattle-sip-your-morning-coffee-from/7520272077.html,1.0,542.0
2022-08-18 14:28:00,Rooftop- Gym- Seattle,1695.0,Spacious Studio available now on Capitol Hill!,https://seattle.craigslist.org/see/apa/d/seattle-spacious-studio-available-now/7520302288.html,,485.0
2022-08-18 14:27:00,"1208 Pine St Seattle, Wa",2695.0,4 weeks free on this 7th floor 1x1 with Large windows & Balcony!,https://seattle.craigslist.org/see/apa/d/seattle-weeks-free-on-this-7th-floor/7522255483.html,1.0,542.0
2022-08-18 14:27:00,Capitol Hill- Paramount Theater- Seattle,2495.0,Spacious 1x1 with lots of windows!,https://seattle.craigslist.org/see/apa/d/seattle-spacious-1x1-with-lots-of/7520642280.html,1.0,693.0
2022-08-18 14:27:00,Capitol Hill ~ Downtown ~ Seattle,2795.0,First month on US! Tour our brand new capitol hill location TODAY!,https://seattle.craigslist.org/see/apa/d/seattle-first-month-on-us-tour-our/7519815691.html,1.0,589.0
2022-08-18 14:27:00,Capitol Hill~ Downtown~ Paramount Theater ~ Seattle,2495.0,700 SF Large 1x1 with the best natural lighting! Tour Today #622,https://seattle.craigslist.org/see/apa/d/seattle-700-sf-large-1x1-with-the-best/7519736672.html,1.0,693.0
2022-08-18 14:27:00,4 Weeks Free! Top Floor Studio! Capitol Hill,2395.0,Extra tall ceilings and city view with this beautiful brand new studio,https://seattle.craigslist.org/see/apa/d/seattle-extra-tall-ceilings-and-city/7521072198.html,,485.0
2022-08-18 14:26:00,Capitol Hill,2100.0,Spacious Studio With Patio! #413 4 WEEKS FREE,https://seattle.craigslist.org/see/apa/d/seattle-spacious-studio-with-patio/7521074716.html,,463.0
2022-08-18 14:26:00,Seattle,2620.0,Beautiful One Bedroom in the Heart of Seattle! Water Views!,https://seattle.craigslist.org/see/apa/d/seattle-beautiful-one-bedroom-in-the/7523098414.html,1.0,705.0
2022-08-18 14:26:00,4 Weeks Free,2195.0,Make your move into the big city! Move to Capitol Hill today!ðŸŒ† #610,https://seattle.craigslist.org/see/apa/d/seattle-make-your-move-into-the-big/7521080256.html,,554.0
2022-08-18 14:25:00,Greenlake,4795.0,Greenlake area 6 bed 3 bath home 2 Kitchens 2 Laundry,https://seattle.craigslist.org/see/apa/d/seattle-greenlake-area-bed-bath-home/7517694276.html,6.0,3000.0
2022-08-18 14:25:00,"Seattle, Capitol Hill, Downtown, Broadway, Amazon, Microsoft",2595.0,Have Some Fun In the Sun on Our Amazing Rooftop! 1x1 w/ Julliette Balc,https://seattle.craigslist.org/see/apa/d/seattle-have-some-fun-in-the-sun-on-our/7523098051.html,1.0,639.0
2022-08-18 14:25:00,19701 112Th Ave Ne,1848.0,Available NowðŸŒ»ðŸŒ¼Reserve your one bedroom TODAYðŸŒ»ðŸŒ¼,https://seattle.craigslist.org/see/apa/d/bothell-available-nowreserve-your-one/7523097992.html,1.0,700.0
2022-08-18 14:25:00,Capitol Hill~ Paramount Theater,2175.0,4 weeks free on this super spacious studio! Check it out today! #611,https://seattle.craigslist.org/see/apa/d/seattle-weeks-free-on-this-super/7521087646.html,,485.0
2022-08-18 14:25:00,"1208 Pine St Seattle, Wa",2195.0,Large studio with floor to ceiling windows. 4 weeks free!!,https://seattle.craigslist.org/see/apa/d/seattle-large-studio-with-floor-to/7521732773.html,,554.0
2022-08-18 14:25:00,"1208 Pine St Seattle, Wa",2895.0,Extra large studio with TWO closets!!!! Secure your tour today!!!,https://seattle.craigslist.org/see/apa/d/seattle-extra-large-studio-with-two/7521810281.html,,593.0
2022-08-18 14:25:00,"1208 Pine St Seattle, Wa",2287.0,"Top floor studio with views to die for, available now!",https://seattle.craigslist.org/see/apa/d/seattle-top-floor-studio-with-views-to/7521822462.html,,554.0
2022-08-18 14:25:00,"1208 Pine St Seattle, Wa",2495.0,Tour this brand new spacious 1x1 today!,https://seattle.craigslist.org/see/apa/d/seattle-tour-this-brand-new-spacious/7522188447.html,1.0,693.0
2022-08-18 14:25:00,Seattle,3800.0,2 Bed / 2 Bath. Convenient in-home washer and dryer included.,https://seattle.craigslist.org/see/apa/d/seattle-bed-bath-convenient-in-home/7523093400.html,2.0,1023.0
2022-08-18 14:25:00,Capitol Hill,1995.0,Brand new studio available today! Never lived in! + Weeks free,https://seattle.craigslist.org/see/apa/d/seattle-brand-new-studio-available/7522252906.html,,441.0
2022-08-18 14:24:00,"337 Ne 103Rd Street Seattle, Wa",3200.0,Plaza 2 Bedroom! Available in August!,https://seattle.craigslist.org/see/apa/d/seattle-plaza-bedroom-available-in/7523097681.html,2.0,841.0
2022-08-18 14:24:00,Columbia City,1849.0,Wonderful Floor Plans! Modern Amenities! Come Tour Today! Specials$$$!,https://seattle.craigslist.org/see/apa/d/seattle-wonderful-floor-plans-modern/7523096858.html,1.0,510.0
2022-08-18 14:23:00,Northgate Seattle,2325.0,âœ¨Large Luxe Plaza One Bedroomâœ¨,https://seattle.craigslist.org/see/apa/d/seattle-large-luxe-plaza-one-bedroom/7523097270.html,1.0,640.0
2022-08-18 14:22:00,Capitol Hill,2175.0,4 week Frees free on this spacious Capitol Hill studio!,https://seattle.craigslist.org/see/apa/d/seattle-week-frees-free-on-this/7523096467.html,,485.0
2022-08-18 14:22:00,Tukwila,1852.0,Home Here at Seasons!! 2 Bedroom / 1 Bath !!,https://seattle.craigslist.org/see/apa/d/seattle-home-here-at-seasons-bedroom/7523096461.html,2.0,915.0
2022-08-18 14:20:00,Seattle,4200.0,"Laurelhurst/Sand Point Townhome Near Seattle Childrenâ€™s, U-Village!",https://seattle.craigslist.org/see/apa/d/seattle-laurelhurst-sand-point-townhome/7523095771.html,3.0,1583.0
2022-08-18 14:20:00,Columbia City,2050.0,"SEATTLE'S MOST DESIRABLE NEIGHBORHOOOD, Extra Storage, Rooftop Deck",https://seattle.craigslist.org/see/apa/d/seattle-seattles-most-desirable/7523095690.html,1.0,650.0
2022-08-18 14:20:00,"2615 1St Avenue, Seattle, Wa",1939.0,"Studio with Cozy Sleeping Alcove, Stainless kitchen, Belltown area",https://seattle.craigslist.org/see/apa/d/seattle-studio-with-cozy-sleeping/7523095650.html,,439.0
2022-08-18 14:20:00,Seattle,3240.0,Condo Quality with modern finishes throughout home 6wks FREE- Belltown,https://seattle.craigslist.org/see/apa/d/seattle-condo-quality-with-modern/7523095590.html,2.0,907.0
2022-08-18 14:20:00,Seattle,3460.0,"Rooftop community clubroom, 3rd & 4th floor meeting rooms, Elevators",https://seattle.craigslist.org/see/apa/d/seattle-rooftop-community-clubroom-3rd/7511227795.html,2.0,957.0
2022-08-18 14:20:00,Seattle,2413.0,Seattle One Bedroom For Rent,https://seattle.craigslist.org/see/apa/d/seattle-seattle-one-bedroom-for-rent/7523095519.html,1.0,555.0
2022-08-18 14:19:00,"Belltown, Slu, Queen Anne",2432.0,Spacious One Bedroom in the Heart of Belltown!,https://seattle.craigslist.org/see/apa/d/seattle-spacious-one-bedroom-in-the/7523095409.html,1.0,659.0
