Post_Date,Neighborhood,Price,Title,Url,Bedroom,sqft
2022-08-16 17:13:00,Uptown/Lower Queen Anne/Seattle Center,2125.0,"Fireplace, On-Site Maintenance, Efficient Appliances, Two Elevators",https://seattle.craigslist.org/see/apa/d/seattle-fireplace-on-site-maintenance/7522323043.html,1.0,586.0
2022-08-16 17:11:00,Seattle,2200.0,2BD AVAILABLE,https://seattle.craigslist.org/see/apa/d/seattle-2bd-available/7522312725.html,2.0,780.0
2022-08-16 17:11:00,Capitol Hill/Madison Park/Central District,2081.0,"Solid surface wood grain flooring, Electric Car Charging Stations",https://seattle.craigslist.org/see/apa/d/seattle-solid-surface-wood-grain/7522322354.html,1.0,566.0
2022-08-16 17:10:00,"200 Sw 5Th Pl, Renton, Wa",1697.0,"View, High Speed Internet Available, Patio/Balcony, Cabana, Playground",https://seattle.craigslist.org/see/apa/d/renton-view-high-speed-internet/7517361034.html,1.0,680.0
2022-08-16 17:10:00,"14700 Ne 35Th St, Bellevue, Wa",2750.0,"2BR 1.5BA Townhome, Fully-equipped kitchen, Open living space, has W/D",https://seattle.craigslist.org/see/apa/d/bellevue-2br-15ba-townhome-fully/7522322090.html,2.0,1057.0
2022-08-16 17:10:00,"800 Ne 42Nd St, Seattle-Tacoma, Wa",950.0,"Refrigerator, Microwave, Secured Garage Parking",https://seattle.craigslist.org/see/apa/d/seattle-refrigerator-microwave-secured/7522322018.html,,
2022-08-16 17:09:00,Capitol Hill,3070.0,1x1 with gorgeous sunlight windows and great storage,https://seattle.craigslist.org/see/apa/d/seattle-1x1-with-gorgeous-sunlight/7522321825.html,1.0,1169.0
2022-08-16 17:09:00,Seattle,2711.0,Spacious 1 Bedroom Apartment w/ Balcony Available Now!,https://seattle.craigslist.org/see/apa/d/seattle-spacious-bedroom-apartment/7514573547.html,1.0,774.0
2022-08-16 17:09:00,Seattle,2025.0,Urban 1 Bedroom w/ Balcony!,https://seattle.craigslist.org/see/apa/d/seattle-urban-bedroom-balcony/7511700435.html,1.0,646.0
2022-08-16 17:08:00,"520 Occidental Ave S, Seattle, Wa",3289.0,Modern Design with a Unique Twist at The Nolo!,https://seattle.craigslist.org/see/apa/d/seattle-modern-design-with-unique-twist/7522321559.html,2.0,834.0
2022-08-16 17:08:00,South Seattle,0.0,We now have a waiting list available!,https://seattle.craigslist.org/see/apa/d/seattle-we-now-have-waiting-list/7522321395.html,,
2022-08-16 17:06:00,West Seattle Alaska Junction,2173.0,"Bike Storage, Spectacular Views, Green Roof Landscaping",https://seattle.craigslist.org/see/apa/d/seattle-bike-storage-spectacular-views/7522320799.html,1.0,765.0
2022-08-16 17:06:00,"Uw, University Of Wa, U-District",1950.0,"Last unit at discount price, 3 bed for $1950, @$650/room, parking, UW",https://seattle.craigslist.org/see/apa/d/seattle-last-unit-at-discount-price-bed/7522320665.html,3.0,770.0
2022-08-16 17:06:00,Fremont,3252.0,Fitness room loaded with professional-grade equipment,https://seattle.craigslist.org/see/apa/d/seattle-fitness-room-loaded-with/7522320603.html,2.0,945.0
2022-08-16 17:06:00,Capitol Hill,2295.0,Charming One Bedroom in Perfect Location - Viva,https://seattle.craigslist.org/see/apa/d/seattle-charming-one-bedroom-in-perfect/7522320554.html,1.0,550.0
2022-08-16 17:05:00,"200 Sw 5Th Pl, Renton, Wa",1693.0,"Near Public Transit, Large Closets, Short Term Lease, Refreshing Pool",https://seattle.craigslist.org/see/apa/d/renton-near-public-transit-large/7522320454.html,1.0,620.0
2022-08-16 17:04:00,Seattle,1695.0,"Code/Keyless Entry, Secured Garage Parking, Cable/ Internet ready",https://seattle.craigslist.org/see/apa/d/seattle-code-keyless-entry-secured/7522316420.html,1.0,556.0
2022-08-16 17:04:00,South Lake Union,3876.0,"Studio, 1-, and 2-bedroom apartments, Full size Washer & Dryer",https://seattle.craigslist.org/see/apa/d/seattle-studio-and-bedroom-apartments/7522319758.html,2.0,975.0
2022-08-16 17:03:00,"Seattle, Capitol Hill, 1St Hill",1825.0,#613. HUGE walk in closet,https://seattle.craigslist.org/see/apa/d/seattle-613-huge-walk-in-closet/7522319415.html,,512.0
2022-08-16 17:01:00,Captiol Hill,2105.0,Sunny and Spacious Studio - Viva,https://seattle.craigslist.org/see/apa/d/seattle-sunny-and-spacious-studio-viva/7522318905.html,,452.0
2022-08-16 17:00:00,"21212 International Boulevard Seatac, Wa",1408.0,HOME FINALLY-DESIGNED WITH SENIORS IN MIND,https://seattle.craigslist.org/see/apa/d/kent-home-finally-designed-with-seniors/7522318612.html,1.0,544.0
2022-08-16 16:59:00,"13543 Greenwood Ave N, Seattle-Tacoma, Wa",1700.0,Love where you live!,https://seattle.craigslist.org/see/apa/d/seattle-love-where-you-live/7513834761.html,1.0,619.0
2022-08-16 16:58:00,Seattle,2462.0,"Breathtaking Views Of The City*, Rooftop Solar Panels",https://seattle.craigslist.org/see/apa/d/seattle-breathtaking-views-of-the-city/7522317758.html,1.0,855.0
2022-08-16 16:58:00,Seattle,2355.0,Set up your perfect home office! Spacious 1 bed plus den in SLU!,https://seattle.craigslist.org/see/apa/d/seattle-set-up-your-perfect-home-office/7522317741.html,1.0,688.0
2022-08-16 16:58:00,Belltown,2690.0,Amazing traditional 1 bed CITY VIEW Great specials,https://seattle.craigslist.org/see/apa/d/seattle-amazing-traditional-bed-city/7522317692.html,1.0,592.0
2022-08-16 16:56:00,Seattle,2650.0,"2 Bedroom Waitlist! Minutes from Harbor Greens, On-Site Pet Run,",https://seattle.craigslist.org/see/apa/d/gig-harbor-bedroom-waitlist-minutes/7522317050.html,2.0,1308.0
2022-08-16 16:55:00,Seattle,3200.0,"Bay Window, Air Conditioning, Security System, Storage Units",https://seattle.craigslist.org/see/apa/d/seattle-bay-window-air-conditioning/7522316989.html,2.0,
2022-08-16 16:55:00,Seattle,2295.0,"Spacious 1 Bedroom in Central District - Pet Friendly, On-Site Parking",https://seattle.craigslist.org/see/apa/d/seattle-spacious-bedroom-in-central/7522316897.html,1.0,573.0
2022-08-16 16:54:00,Wallingford Fremont,2596.0,"Porcelain tile backsplashes, Chalk Board Accent Walls",https://seattle.craigslist.org/see/apa/d/seattle-porcelain-tile-backsplashes/7522316591.html,1.0,686.0
2022-08-16 16:54:00,"3231 S 204Th St, Seatac, Wa",1737.0,"Fully Renovated Apartments, Pet Friendly, On-Site Management",https://seattle.craigslist.org/see/apa/d/seattle-fully-renovated-apartments-pet/7514861650.html,1.0,725.0
2022-08-16 16:53:00,"8026 15Th Avenue Northwest, Seattle-Tacoma, Wa",1795.0,"Secured Garage Parking, Code/Keyless Entry, Secured Entry",https://seattle.craigslist.org/see/apa/d/seattle-secured-garage-parking-code/7519775360.html,1.0,677.0
2022-08-16 16:53:00,"8026 15Th Avenue Northwest, Seattle-Tacoma, Wa",1795.0,"On-Site Management, Rooftop Entertainment Patio with BBQ, Elevator",https://seattle.craigslist.org/see/apa/d/seattle-on-site-management-rooftop/7519265600.html,1.0,677.0
2022-08-16 16:53:00,Seattle,1695.0,"Secured Entry, On-Site Management, Elevator",https://seattle.craigslist.org/see/apa/d/seattle-secured-entry-on-site/7517760739.html,1.0,556.0
2022-08-16 16:53:00,"8026 15Th Avenue Northwest, Seattle-Tacoma, Wa",1745.0,"Harwood/Vinyl Floors, Bicycle Storage, Elevator",https://seattle.craigslist.org/see/apa/d/seattle-harwood-vinyl-floors-bicycle/7517826069.html,1.0,558.0
2022-08-16 16:52:00,Seattle,1795.0,"Rooftop Entertainment Patio with BBQ, Secured Entry, Elevator",https://seattle.craigslist.org/see/apa/d/seattle-rooftop-entertainment-patio/7522315772.html,1.0,677.0
2022-08-16 16:51:00,Seattle,1880.0,"Off-Leash Dog Park, Garbage Disposal, In-Home Washer & Dryer",https://seattle.craigslist.org/see/apa/d/seattle-off-leash-dog-park-garbage/7522315654.html,1.0,739.0
2022-08-16 16:51:00,"2226 Elliott Ave, Seattle, Wa",2150.0,"Ideal 1BR 1BA apt, Fully-equipped kitchen, Spacious deck w/ pool view",https://seattle.craigslist.org/see/apa/d/seattle-ideal-1br-1ba-apt-fully/7522315602.html,1.0,700.0
2022-08-16 16:51:00,Seattle,2800.0,"Join Our Waitlist, Abundant Closet Space, Awesome Gig Harbor location!",https://seattle.craigslist.org/see/apa/d/gig-harbor-join-our-waitlist-abundant/7522315587.html,3.0,1418.0
2022-08-16 16:50:00,"521 Stadium Place S, Seattle, Wa",2278.0,Bright Open Floor Plans at The Wave!,https://seattle.craigslist.org/see/apa/d/seattle-bright-open-floor-plans-at-the/7522315070.html,1.0,594.0
2022-08-16 16:49:00,19701 112Th Ave Ne,2395.0,Ready to Move inðŸŒ»ðŸŒ¼Reserve your spacious Two bedroom NOWðŸŒ»ðŸŒ¼,https://seattle.craigslist.org/see/apa/d/bothell-ready-to-move-inreserve-your/7522314744.html,2.0,962.0
2022-08-16 16:49:00,Belltown,1949.0,"Billiards Room, Easy access to I5, 99, 520 and I90, Key fob entry",https://seattle.craigslist.org/see/apa/d/seattle-billiards-room-easy-access-to/7522314702.html,,463.0
2022-08-16 16:48:00,Seattle,2400.0,"Waitlist Open! Ceiling Fans, Tub/Shower, Gourmet Kitchens",https://seattle.craigslist.org/see/apa/d/gig-harbor-waitlist-open-ceiling-fans/7522314642.html,3.0,1308.0
2022-08-16 16:47:00,Kirkland,2245.0,"$2,485 / 1br - 748sqft - 1B/1B-Granite Counters// $1000 Off!!",https://seattle.craigslist.org/see/apa/d/bellevue-br-748sqft-1b-1b-granite/7522314336.html,1.0,748.0
2022-08-16 16:47:00,Northgate,1525.0,"Pet Friendly, Close Proximity to Seattle & I-5, Dishwasher",https://seattle.craigslist.org/see/apa/d/seattle-pet-friendly-close-proximity-to/7517477005.html,1.0,570.0
2022-08-16 16:47:00,Seattle,1575.0,One month free on select homes! Great location!,https://seattle.craigslist.org/see/apa/d/seattle-one-month-free-on-select-homes/7520694962.html,,420.0
2022-08-16 16:46:00,"12508 Lake City Way Ne Seattle, Wa",1400.0,"Studio w/ W&D, & Open Floorplan.",https://seattle.craigslist.org/see/apa/d/seattle-studio-wd-open-floorplan/7522313971.html,,460.0
2022-08-16 16:45:00,Capitol Hill,1500.0,Classic 1 bedroom on Capitol Hill,https://seattle.craigslist.org/see/apa/d/seattle-classic-bedroom-on-capitol-hill/7522313366.html,1.0,
2022-08-16 16:44:00,Belltown,2975.0,A Deal That Would Make You Look Twice! #2413,https://seattle.craigslist.org/see/apa/d/seattle-deal-that-would-make-you-look/7522313074.html,1.0,708.0
2022-08-16 16:44:00,Kent,1736.0,"Washer/Dryer, Dog Parks, Free Bike Storage",https://seattle.craigslist.org/see/apa/d/seattle-washer-dryer-dog-parks-free/7518944983.html,1.0,700.0
2022-08-16 16:43:00,Seattle,2350.0,Stunning Top Floor 1 Bedroom Home With Brand New Renovations!!,https://seattle.craigslist.org/see/apa/d/seattle-stunning-top-floor-bedroom-home/7522312696.html,1.0,660.0
2022-08-16 16:43:00,South Lake Union,4504.0,Upscale Urban Oasis | 4 weeks free!,https://seattle.craigslist.org/see/apa/d/seattle-upscale-urban-oasis-weeks-free/7522312644.html,2.0,1108.0
2022-08-16 16:41:00,Seattle,3046.0,"Air conditioning, Yoga room with on-demand fitness programs",https://seattle.craigslist.org/see/apa/d/seattle-air-conditioning-yoga-room-with/7522312070.html,1.0,634.0
2022-08-16 16:41:00,"1525 9Th Ave, Seattle, Wa",2870.0,"Gas Stove, Southeast View, Reservable Work-From-Home Units",https://seattle.craigslist.org/see/apa/d/seattle-gas-stove-southeast-view/7521445611.html,1.0,627.0
2022-08-16 16:41:00,"12508 Lake City Way Ne Seattle, Wa",2135.0,2 Bedroom 1 Bathroom Available Soon,https://seattle.craigslist.org/see/apa/d/seattle-bedroom-bathroom-available-soon/7522311973.html,2.0,890.0
2022-08-16 16:41:00,Seattle,3872.0,Gorgeous Two Bedroom With All You Will Ever Need!!,https://seattle.craigslist.org/see/apa/d/seattle-gorgeous-two-bedroom-with-all/7522311916.html,2.0,960.0
2022-08-16 16:40:00,"12508 Lake City Way Ne Seattle, Wa",1650.0,"Gorgeous, Renovated Studio Available for Immediate Move In!",https://seattle.craigslist.org/see/apa/d/seattle-gorgeous-renovated-studio/7522311659.html,,560.0
2022-08-16 16:40:00,Seattle,950.0,"Assigned Parking, Secured Entry, Refrigerator",https://seattle.craigslist.org/see/apa/d/seattle-assigned-parking-secured-entry/7517753534.html,,
2022-08-16 16:40:00,"800 Ne 42Nd St, Seattle-Tacoma, Wa",950.0,"Secured Entry, Private Bathroom, Storage Units Available",https://seattle.craigslist.org/see/apa/d/seattle-secured-entry-private-bathroom/7519297919.html,,
2022-08-16 16:39:00,"800 Ne 42Nd St, Seattle-Tacoma, Wa",950.0,"Storage Units Available, Refrigerator, Microwave",https://seattle.craigslist.org/see/apa/d/seattle-storage-units-available/7517818338.html,,
2022-08-16 16:39:00,Seattle,950.0,"Microwave, Secured Entry, Storage Units Available",https://seattle.craigslist.org/see/apa/d/seattle-microwave-secured-entry-storage/7517263644.html,,
2022-08-16 16:38:00,Seattle,950.0,"Storage Units Available, Secured Garage Parking, Secured Entry",https://seattle.craigslist.org/see/apa/d/seattle-storage-units-available-secured/7522311109.html,,
2022-08-16 16:38:00,Capitol Hill,3671.0,"Rooftop Deck, Multiple Cable Hookups Per Apartment, Fitness Center",https://seattle.craigslist.org/see/apa/d/seattle-rooftop-deck-multiple-cable/7522310845.html,2.0,899.0
2022-08-16 16:37:00,Seattle,3596.0,Great Experiences Are Just Around The Corner!,https://seattle.craigslist.org/see/apa/d/seattle-great-experiences-are-just/7515396117.html,2.0,843.0
2022-08-16 16:37:00,Seattle,1918.0,Top floor Studio in the Central District!,https://seattle.craigslist.org/see/apa/d/seattle-top-floor-studio-in-the-central/7513405261.html,,481.0
2022-08-16 16:37:00,"12508 Lake City Way Ne Seattle, Wa",1710.0,This One Bedroom Has It ALL ðŸ–¤,https://seattle.craigslist.org/see/apa/d/seattle-this-one-bedroom-has-it-all/7522310539.html,1.0,590.0
2022-08-16 16:36:00,Seattle,3932.0,Looking for a townhome? Look no further!! Call The Midtown Square now!,https://seattle.craigslist.org/see/apa/d/seattle-looking-for-townhome-look-no/7519836129.html,2.0,1150.0
2022-08-16 16:36:00,Seattle,3596.0,Blending Relaxation & Sophistication to Create the Ideal Place.,https://seattle.craigslist.org/see/apa/d/seattle-blending-relaxation/7521049772.html,2.0,843.0
2022-08-16 16:35:00,Seattle,2007.0,"Package storage, Roof deck, Elevators, Parking garage",https://seattle.craigslist.org/see/apa/d/seattle-package-storage-roof-deck/7520598413.html,,
2022-08-16 16:34:00,Seattle,2007.0,"Parking garage, Elevators, Vibrant artwork",https://seattle.craigslist.org/see/apa/d/seattle-parking-garage-elevators/7520223726.html,,
2022-08-16 16:34:00,"South Lake Union, Downtown Seattle, Capitol Hill",2232.0,"1st Floor Urban 1x1, Available Now- 2 Weeks FREE!",https://seattle.craigslist.org/see/apa/d/seattle-1st-floor-urban-1x1-available/7522309633.html,1.0,670.0
2022-08-16 16:34:00,Renton - 15 Minute Drive To Kubota Gardens,2476.0,Dog and Cat-Friendly 889 SqFt 2 Bed / 1 Bath! Pets Welcome Here!,https://seattle.craigslist.org/see/apa/d/renton-dog-and-cat-friendly-889-sqft/7522307558.html,2.0,889.0
2022-08-16 16:33:00,"2510 Western Avenue, Suite 100 , Seattle, Wa",1489.0,"Walk-In Closets, Upgraded Appliances, Views of Elliott Bay",https://seattle.craigslist.org/see/apa/d/seattle-walk-in-closets-upgraded/7522309332.html,,444.0
2022-08-16 16:33:00,"2615 1St Avenue, Seattle, Wa",2200.0,"This one won't last! Ideal 1BR 1BA apt, Walk-in closet, Modern kitchen",https://seattle.craigslist.org/see/apa/d/seattle-this-one-wont-last-ideal-1br/7522309247.html,1.0,654.0
2022-08-16 16:33:00,Seattle,3495.0,98 Union Condo,https://seattle.craigslist.org/see/apa/d/seattle-98-union-condo/7518024659.html,1.0,838.0
2022-08-16 16:33:00,"1321 Minor Ave, Seattle, Wa",1995.0,1BR 1BA apt | Open living space | Washer/Dryer inside | Modern kitchen,https://seattle.craigslist.org/see/apa/d/seattle-1br-1ba-apt-open-living-space/7522309019.html,1.0,647.0
2022-08-16 16:32:00,Seattle,2199.0,2 BED *specials* AVAILABLE NOW! PET FRIENDLY! W/D In-Unit!,https://seattle.craigslist.org/see/apa/d/seattle-bed-specials-available-now-pet/7522308939.html,2.0,950.0
2022-08-16 16:32:00,"Discovery Pointe, Magnolia, Seattle, Wa",2295.0,2 Bed/1 Bath Apartment in Magnolia Available Sept 9th,https://seattle.craigslist.org/see/apa/d/seattle-bed-bath-apartment-in-magnolia/7522308829.html,2.0,950.0
2022-08-16 16:32:00,Seattle,900.0,"Private Bathroom, Garage Parking, Close to UW",https://seattle.craigslist.org/see/apa/d/seattle-private-bathroom-garage-parking/7519733554.html,,
2022-08-16 16:32:00,"520 Occidental Ave S, Seattle, Wa",2849.0,Urban Living at The Nolo in Historic Pioneer Square,https://seattle.craigslist.org/see/apa/d/seattle-urban-living-at-the-nolo-in/7519468425.html,1.0,765.0
2022-08-16 16:31:00,"520 Occidental Ave S, Seattle, Wa",2220.0,Modern Design with a Unique Twist at The Nolo!,https://seattle.craigslist.org/see/apa/d/seattle-modern-design-with-unique-twist/7522308303.html,1.0,779.0
2022-08-16 16:31:00,"Lower Queen Anne, Belltown, Denny Triangle, Denny Way",3872.0,Large 2x1 in lower Queen Anne (luxury),https://seattle.craigslist.org/see/apa/d/seattle-large-2x1-in-lower-queen-anne/7522303172.html,2.0,941.0
2022-08-16 16:30:00,Seattle,3155.0,"If you commute, you'll want to check us out! Near public transport",https://seattle.craigslist.org/see/apa/d/seattle-if-you-commute-youll-want-to/7522300623.html,2.0,998.0
2022-08-16 16:29:00,University District,1750.0,"U-District Studio, Walk to UW & The Ave - BRAND NEW EVERYTHING!!",https://seattle.craigslist.org/see/apa/d/seattle-district-studio-walk-to-uw-the/7517454720.html,,320.0
2022-08-16 16:28:00,Seattle,2900.0,Access to Mount Rainier and Seattle skyline views*,https://seattle.craigslist.org/see/apa/d/seattle-access-to-mount-rainier-and/7522307411.html,2.0,900.0
2022-08-16 16:28:00,Seattle,2728.0,Corner unit with lots of window! Fire place! Washer & dryer!,https://seattle.craigslist.org/see/apa/d/lynnwood-corner-unit-with-lots-of/7522307256.html,3.0,1221.0
2022-08-16 16:28:00,Greenlake,1495.0,1 MONTH FREE RENT!! Newly Renovated - Be the 1st To Apply!!!,https://seattle.craigslist.org/see/apa/d/seattle-month-free-rent-newly-renovated/7517451559.html,1.0,600.0
2022-08-16 16:27:00,"255 Lenora St, Seattle, Wa",2628.0,Breakfast Served On The Weekend and 24-hour front desk coverage!,https://seattle.craigslist.org/see/apa/d/seattle-breakfast-served-on-the-weekend/7519843473.html,,510.0
2022-08-16 16:27:00,Interbay,2695.0,"STUNNING VIEWS ðŸŒŠ W/D in Unit, Fireplace, Balcony!! Let's Tour!",https://seattle.craigslist.org/see/apa/d/seattle-stunning-views-d-in-unit/7517450080.html,2.0,1037.0
2022-08-16 16:27:00,Renton - 15 Minute Drive To Kubota Gardens,2028.0,Simply beautiful 1 bed / 1 bath in prime Renton neighborhood,https://seattle.craigslist.org/see/apa/d/renton-simply-beautiful-bed-bath-in/7522306794.html,1.0,650.0
2022-08-16 16:26:00,Greenwood,3195.0,Unique HUGE 3-Bedroom by Carkeek Park!!! Great Building with Balcony,https://seattle.craigslist.org/see/apa/d/seattle-unique-huge-bedroom-by-carkeek/7517448153.html,3.0,
2022-08-16 16:25:00,Capitol Hill,2295.0,Quiet Area on Cap Hill â˜… Walk to Broadway & Volunteer Park!!!,https://seattle.craigslist.org/see/apa/d/seattle-quiet-area-on-cap-hill-walk-to/7517443669.html,2.0,695.0
2022-08-16 16:25:00,Seattle,1399.0,"55+ High ceilings, TV lounge and social areas, On-site beauty shop",https://seattle.craigslist.org/see/apa/d/renton-55-high-ceilings-tv-lounge-and/7520164001.html,1.0,560.0
2022-08-16 16:24:00,"701 5Th Ave N Seattle, Wa",3875.0,2 Bed 2 Bath - Available September 5!!,https://seattle.craigslist.org/see/apa/d/seattle-bed-bath-available-september/7522305743.html,2.0,939.0
2022-08-16 16:24:00,"701 5Th Ave N Seattle, Wa",2025.0,Studio Apartment - Available September 5!!,https://seattle.craigslist.org/see/apa/d/seattle-studio-apartment-available/7522305711.html,,561.0
2022-08-16 16:24:00,Fremont,1225.0,Sunny Fremont Apartment with Huge Balcony!,https://seattle.craigslist.org/see/apa/d/seattle-sunny-fremont-apartment-with/7522305691.html,1.0,
2022-08-16 16:24:00,"701 5Th Ave N Seattle, Wa",2395.0,Ground Floor Urban 1 Bed - Available September 5!!,https://seattle.craigslist.org/see/apa/d/seattle-ground-floor-urban-bed/7522305682.html,1.0,657.0
2022-08-16 16:23:00,Seattle,1359.0,"Close to Restaurants, Walk-In Closet, Elevator",https://seattle.craigslist.org/see/apa/d/seattle-close-to-restaurants-walk-in/7520257985.html,,186.0
2022-08-16 16:23:00,Seattle,2072.0,ONE MONTH FREE! Brand NEW Homes Near Greenlake & I-5!!,https://seattle.craigslist.org/see/apa/d/seattle-one-month-free-brand-new-homes/7522305415.html,1.0,497.0
2022-08-16 16:23:00,Volunteer Park,4495.0,GORGEOUS Historic Property by Volunteer Park!! ðŸ˜ Fully Renovated ðŸ˜,https://seattle.craigslist.org/see/apa/d/seattle-gorgeous-historic-property-by/7511718630.html,2.0,1202.0
2022-08-16 16:22:00,Seattle,2550.0,Now Preleasing 2 Bedroom Home - International District,https://seattle.craigslist.org/see/apa/d/seattle-now-preleasing-bedroom-home/7522305277.html,2.0,840.0
2022-08-16 16:22:00,Capitol Hill,2600.0,Classic 2 bedroom Capitol Hill,https://seattle.craigslist.org/see/apa/d/seattle-classic-bedroom-capitol-hill/7522305216.html,2.0,
2022-08-16 16:22:00,Seattle,2479.0,1 month free! 2 bedroom 1 bath ! available NOW!!,https://seattle.craigslist.org/see/apa/d/seattle-month-free-bedroom-bath/7522305209.html,2.0,950.0
2022-08-16 16:20:00,Seattle,1675.0,1 BEDROOM VINTAGE APARTMENT,https://seattle.craigslist.org/see/apa/d/seattle-bedroom-vintage-apartment/7522304302.html,1.0,746.0
2022-08-16 16:19:00,Magnolia,1995.0,Unique Townhouse Layout w/ Private Courtyard ðŸŒŠ POOL & Huge Windows,https://seattle.craigslist.org/see/apa/d/seattle-unique-townhouse-layout-private/7511675700.html,1.0,900.0
2022-08-16 16:19:00,Seattle - Center,2705.0,Spectacular city living can be yours! Amazing high-rise 1 BR 1 BA!,https://seattle.craigslist.org/see/apa/d/seattle-spectacular-city-living-can-be/7522293373.html,1.0,658.0
2022-08-16 16:18:00,University District,1795.0,"Beautiful FULLY RENOVATED, Washer/Dryer In-Unit!! Hardwood, U-District",https://seattle.craigslist.org/see/apa/d/seattle-beautiful-fully-renovated/7519406453.html,1.0,725.0
2022-08-16 16:18:00,Central District / Capitol Hill,2371.0,"Spacious 1 Bedroom for August, Call for more Information",https://seattle.craigslist.org/see/apa/d/seattle-spacious-bedroom-for-august/7522303680.html,1.0,548.0
2022-08-16 16:18:00,Ballard,1950.0,Ballard - Top floor unit with Balcony and Fireplace,https://seattle.craigslist.org/see/apa/d/seattle-ballard-top-floor-unit-with/7522303583.html,2.0,
2022-08-16 16:17:00,Kent,1350.0,"Pet Friendly, Pool, Walk-in Closets*, Garbage Disposal*",https://seattle.craigslist.org/see/apa/d/kent-pet-friendly-pool-walk-in-closets/7522303406.html,1.0,636.0
2022-08-16 16:16:00,"701 5Th Ave N Seattle, Wa",2025.0,Studio Apartment - Available September 5!!!,https://seattle.craigslist.org/see/apa/d/seattle-studio-apartment-available/7522302869.html,,531.0
2022-08-16 16:16:00,University District,1595.0,"Walk to UW, Great Location!!! Fireplace, Large Floorplan",https://seattle.craigslist.org/see/apa/d/seattle-walk-to-uw-great-location/7519407948.html,1.0,600.0
2022-08-16 16:15:00,Columbia City,3680.0,"Views, Extra Storage, Rooftop Deck",https://seattle.craigslist.org/see/apa/d/seattle-views-extra-storage-rooftop-deck/7515630367.html,2.0,866.0
2022-08-16 16:15:00,"2619 5Th Avenue, Seattle, Wa",1499.0,"Dark Cherry Hardwood Vinyl Flooring, High Ceilings, Internet Ready",https://seattle.craigslist.org/see/apa/d/seattle-dark-cherry-hardwood-vinyl/7522302427.html,,359.0
2022-08-16 16:14:00,Volunteer Park,4495.0,STUNNING Fully Renovated Vintage Building w Sunroom/Office Bay Windows,https://seattle.craigslist.org/see/apa/d/seattle-stunning-fully-renovated/7519726746.html,2.0,1202.0
2022-08-16 16:14:00,"2510 Western Avenue, Suite 100 , Seattle, Wa",1450.0,"Pet Friendly, Superior Maintenance, Walk-In Closets",https://seattle.craigslist.org/see/apa/d/seattle-pet-friendly-superior/7511668760.html,,436.0
2022-08-16 16:14:00,"14700 Ne 35Th St, Bellevue, Wa",2650.0,"Bellevue 2BR apt, Well-equipped kitchen, Open concept plan, W/D inside",https://seattle.craigslist.org/see/apa/d/bellevue-bellevue-2br-apt-well-equipped/7522302184.html,2.0,950.0
2022-08-16 16:14:00,"701 5Th Ave N Seattle, Wa",2575.0,Large Urban 1 Bed 1 Bath - Available October 5!!,https://seattle.craigslist.org/see/apa/d/seattle-large-urban-bed-bath-available/7522302165.html,1.0,655.0
2022-08-16 16:14:00,"701 5Th Ave N Seattle, Wa",2200.0,Urban 1 Bed 1 Bath - Available December 5!!,https://seattle.craigslist.org/see/apa/d/seattle-urban-bed-bath-available/7522302135.html,1.0,563.0
2022-08-16 16:14:00,"701 5Th Ave N Seattle, Wa",2700.0,Huge Traditional 1 Bed - Available September 5!!,https://seattle.craigslist.org/see/apa/d/seattle-huge-traditional-bed-available/7522302096.html,1.0,853.0
2022-08-16 16:14:00,Mercer Island,2630.0,Don't Wait - Tour This Home from Your Phone NOW,https://seattle.craigslist.org/see/apa/d/mercer-island-dont-wait-tour-this-home/7522302063.html,1.0,789.0
2022-08-16 16:13:00,Capitol Hill,3295.0,ðŸŒžSTUNNING VIEWS of Downtown & Space Needle!!! Huge Floorplan + 2 Beds,https://seattle.craigslist.org/see/apa/d/seattle-stunning-views-of-downtown/7519748081.html,2.0,1055.0
2022-08-16 16:13:00,"200 Sw 5Th Pl, Renton, Wa",2269.0,"Patio/Balcony, Night Patrol, Short Term Lease, Fitness Center, Cabana",https://seattle.craigslist.org/see/apa/d/renton-patio-balcony-night-patrol-short/7522301711.html,2.0,1003.0
2022-08-16 16:12:00,"337 Ne 103Rd Street Seattle, Wa",2100.0,Large Studio Now Available with $500 Look and Lease Special ðŸ¤©,https://seattle.craigslist.org/see/apa/d/seattle-large-studio-now-available-with/7522298408.html,,606.0
2022-08-16 16:12:00,"521 Stadium Place S, Seattle, Wa",2135.0,Bright Open Floor Plans at The Wave!,https://seattle.craigslist.org/see/apa/d/seattle-bright-open-floor-plans-at-the/7522301236.html,1.0,589.0
2022-08-16 16:11:00,Seattle,2900.0,"24 hour fitness center!, Underground controlled-access parking",https://seattle.craigslist.org/see/apa/d/seattle-24-hour-fitness-center/7522301047.html,2.0,900.0
