Post_Date,Neighborhood,Price,Title,Url,Bedroom,sqft
2022-08-17 11:49:00,Seattle,1875.0,Best Place to Get Cozy+ Charming Top Floor With Fireplace & Balcony!,https://seattle.craigslist.org/see/apa/d/seattle-best-place-to-get-cozy-charming/7522609965.html,1.0,650.0
2022-08-17 11:45:00,Seattle,2327.0,"Business Center, Guest Room, Elevator",https://seattle.craigslist.org/see/apa/d/seattle-business-center-guest-room/7522607978.html,1.0,448.0
2022-08-17 11:45:00,Kitsap,2225.0,"Find Your Next Haven, Brand New Port Orchard Apts Available Oct 2022",https://seattle.craigslist.org/see/apa/d/port-orchard-find-your-next-haven-brand/7522607749.html,2.0,1049.0
2022-08-17 11:44:00,"Seattle,Capitol Hill,First Hill",1995.0,"Bright open living space, Modern kitchen, W/D inside, Your 1BR 1BA apt",https://seattle.craigslist.org/see/apa/d/seattle-bright-open-living-space-modern/7522607318.html,1.0,647.0
2022-08-17 11:44:00,"Seattle, Capitol Hill, 1St Hill",2480.0,"#610. Realize Luxury, Fitness Center, Walkscore 95",https://seattle.craigslist.org/see/apa/d/seattle-610-realize-luxury-fitness/7522607029.html,1.0,624.0
2022-08-17 11:43:00,Wallingford Fremont,2445.0,Stunning SE Corner w/ Floor-Ceiling Windows! 2 On-Site Gyms! Dog Park!,https://seattle.craigslist.org/see/apa/d/seattle-stunning-se-corner-floor/7522606983.html,1.0,660.0
2022-08-17 11:43:00,West Seattle,3596.0,"Stainless Steel Appliances, On Site Management, Microwave, Dishwasher",https://seattle.craigslist.org/see/apa/d/seattle-stainless-steel-appliances-on/7522606550.html,2.0,1287.0
2022-08-17 11:43:00,Seattle,1245.0,ðŸ’–Charming Studio with In-Unit Laundry in Central District! WEL G,https://seattle.craigslist.org/see/apa/d/seattle-charming-studio-with-in-unit/7522573534.html,,240.0
2022-08-17 11:42:00,Seattle,6673.0,Help yourself with the amenities you deserve.,https://seattle.craigslist.org/see/apa/d/seattle-help-yourself-with-the/7522606307.html,2.0,1916.0
2022-08-17 11:42:00,U-District Near Uw,1199.0,Brand New Apartments Opening this Fall - LEASING NOW!,https://seattle.craigslist.org/see/apa/d/seattle-brand-new-apartments-opening/7522606291.html,,
2022-08-17 11:42:00,Northgate,2185.0,"Sundeck and Lounge Area, Ample Storage Space, BBQ/Picnic Area",https://seattle.craigslist.org/see/apa/d/seattle-sundeck-and-lounge-area-ample/7517043827.html,1.0,625.0
2022-08-17 11:41:00,Ballard,2670.0,"Furnished Studio, Flexible lease terms as short as 4 months! Top Floor",https://seattle.craigslist.org/see/apa/d/seattle-furnished-studio-flexible-lease/7516904900.html,,488.0
2022-08-17 11:41:00,Redmond/Bellevue/Microsoft,3095.0,"Great plan flow! 2BR Townhouse, Modern kitchen, Washer/Dryer inside",https://seattle.craigslist.org/see/apa/d/bellevue-great-plan-flow-2br-townhouse/7522605857.html,2.0,1100.0
2022-08-17 11:41:00,Bremerton,2320.0,"Washer and dryer in every unit, Balcony or patio for every unit",https://seattle.craigslist.org/see/apa/d/bremerton-washer-and-dryer-in-every/7522605642.html,2.0,1053.0
2022-08-17 11:41:00,Seattle,2240.0,"Beautiful, large 1x1 - Floor to Ceiling Windows",https://seattle.craigslist.org/see/apa/d/seattle-beautiful-large-1x1-floor-to/7522605598.html,1.0,525.0
2022-08-17 11:40:00,Queen Anne,3474.0,"Corner 2-Bedroom, 2-Bathroom Apartment with Very High Ceilings!",https://seattle.craigslist.org/see/apa/d/seattle-corner-bedroom-bathroom/7522605415.html,2.0,1057.0
2022-08-17 11:40:00,Seattle,1935.0,"Clean and spacious 511 Sq Ft, Studio with gorgeous views",https://seattle.craigslist.org/see/apa/d/seattle-clean-and-spacious-511-sq-ft/7522605340.html,,511.0
2022-08-17 11:40:00,Columbia City,4000.0,House in Columbia City!,https://seattle.craigslist.org/see/apa/d/seattle-house-in-columbia-city/7510480025.html,3.0,1500.0
2022-08-17 11:40:00,Seward Park,2700.0,3 Bedroom 1 Bth House with Yard--Seward Park!,https://seattle.craigslist.org/see/apa/d/seattle-bedroom-bth-house-with-yard/7511210718.html,3.0,
2022-08-17 11:39:00,Uptown/Lower Queen Anne/Seattle Center,2125.0,"Washer And Dryer, Private Patios With Storage, On-Site Maintenance",https://seattle.craigslist.org/see/apa/d/seattle-washer-and-dryer-private-patios/7522604732.html,1.0,586.0
2022-08-17 11:38:00,Seattle,2795.0,Stunning City Views Of Your Very Own! ArrivÃ© Seattle,https://seattle.craigslist.org/see/apa/d/seattle-stunning-city-views-of-your/7522604158.html,1.0,792.0
2022-08-17 11:37:00,Eastlake,3834.0,Custom cabinetry in two different finishes,https://seattle.craigslist.org/see/apa/d/seattle-custom-cabinetry-in-two/7522603929.html,2.0,1066.0
2022-08-17 11:37:00,Seattle,2462.0,"Heart of downtown seattle, beautiful spacious apartment!",https://seattle.craigslist.org/see/apa/d/seattle-heart-of-downtown-seattle/7522603784.html,1.0,855.0
2022-08-17 11:35:00,Seattle/University District,3400.0,"[Pre-leasing for school year 22-23] Shared housing for group of 4,6,10",https://seattle.craigslist.org/see/apa/d/seattle-pre-leasing-for-school-year/7522602786.html,4.0,
2022-08-17 11:34:00,Seattle,1595.0,âœ¨Vintage 1 bd/1ba in Central Ballard! CS 8,https://seattle.craigslist.org/see/apa/d/seattle-vintage-bd-1ba-in-central/7522582372.html,1.0,500.0
2022-08-17 11:32:00,Seattle,1683.0,"Spacious patio or balcony, Social kitchen and dining area, Bike racks",https://seattle.craigslist.org/see/apa/d/renton-spacious-patio-or-balcony-social/7516095696.html,2.0,750.0
2022-08-17 11:32:00,Wallingford,3310.0,Large 1-BDRM With Lots of Closet Space!,https://seattle.craigslist.org/see/apa/d/seattle-large-bdrm-with-lots-of-closet/7522601002.html,1.0,809.0
2022-08-17 11:30:00,Seattle,1832.0,"Nearby Local Shops & Eateries, Private Balcony, Large Kitchen!",https://seattle.craigslist.org/see/apa/d/seattle-nearby-local-shops-eateries/7522600107.html,,445.0
2022-08-17 11:29:00,Ballard,1350.0,"Centrally Located Charming Vintage Studio, Hardwood Floors!",https://seattle.craigslist.org/see/apa/d/seattle-centrally-located-charming/7522599514.html,,457.0
2022-08-17 11:28:00,"520 Occidental Ave S, Seattle, Wa",1949.0,"Washer and Dryer, Air Conditioning, Fitness Center and Yoga Rooms",https://seattle.craigslist.org/see/apa/d/seattle-washer-and-dryer-air/7522599110.html,,520.0
2022-08-17 11:28:00,"Seattle,Seattle Waterfront,Belltown,Elliott Avenue",2950.0,Belltown 2BR 2BA apt | Unique floor plan | Modern kitchen | W/D inside,https://seattle.craigslist.org/see/apa/d/seattle-belltown-2br-2ba-apt-unique/7522599090.html,2.0,975.0
2022-08-17 11:28:00,Wallingford,3970.0,1-BDRM + Den with Special Discount Over Market Price!,https://seattle.craigslist.org/see/apa/d/seattle-bdrm-den-with-special-discount/7522598922.html,1.0,1006.0
2022-08-17 11:27:00,"South Lake Union, Seattle",1895.0,"Bright, Modern, Walkable, Great Views... Clark Has It All!",https://seattle.craigslist.org/see/apa/d/seattle-bright-modern-walkable-great/7522593241.html,,463.0
2022-08-17 11:27:00,"Ballard, Fremont, Frelard, Interbay, Queen Anne",2849.0,Wonderful Light in Our Open Large One Bedroom Home || LEVA on Market,https://seattle.craigslist.org/see/apa/d/seattle-wonderful-light-in-our-open/7522598665.html,1.0,917.0
2022-08-17 11:27:00,Kent,1880.0,"Dog Parks, Stainless Steel Appliances, Wood Look Flooring",https://seattle.craigslist.org/see/apa/d/seattle-dog-parks-stainless-steel/7517336950.html,2.0,864.0
2022-08-17 11:23:00,Seattle,1875.0,Ask about the move in special!,https://seattle.craigslist.org/see/apa/d/seattle-ask-about-the-move-in-special/7520120406.html,1.0,540.0
2022-08-17 11:22:00,Capitol Hill,3200.0,Two-bedroom Anhalt Townhouse one block from Kaiser Permanente,https://seattle.craigslist.org/see/apa/d/seattle-two-bedroom-anhalt-townhouse/7512014287.html,2.0,950.0
2022-08-17 11:22:00,"3490 Sw Graham St, Seattle-Tacoma, Wa",1895.0,"1 bedroom 1 bath, Gourmet Kitchens, Outdoor Firepit, Etc",https://seattle.craigslist.org/see/apa/d/seattle-bedroom-bath-gourmet-kitchens/7513791129.html,1.0,705.0
2022-08-17 11:21:00,Capitol Hill,1400.0,"Crown Molding, Secured Entry, Conveniently Located",https://seattle.craigslist.org/see/apa/d/seattle-crown-molding-secured-entry/7522595758.html,,538.0
2022-08-17 11:21:00,Seattle,2032.0,8 WEEKS FREE On This Brand New 1x1 in Greenwood!,https://seattle.craigslist.org/see/apa/d/seattle-weeks-free-on-this-brand-new/7522595487.html,1.0,575.0
2022-08-17 11:21:00,N Admiral,3275.0,West Seattle 3 bed/1 ba,https://seattle.craigslist.org/see/apa/d/seattle-west-seattle-bed-ba/7516967580.html,3.0,1509.0
2022-08-17 11:21:00,West Seattle,3275.0,"North Admiral, 3 bedroom",https://seattle.craigslist.org/see/apa/d/seattle-north-admiral-bedroom/7516277706.html,3.0,1500.0
2022-08-17 11:19:00,"520 Occidental Ave S, Seattle, Wa",3299.0,The Nolo featuring gorgeous Apartments with a Unique Twist!,https://seattle.craigslist.org/see/apa/d/seattle-the-nolo-featuring-gorgeous/7518249329.html,2.0,834.0
2022-08-17 11:19:00,Seattle,1725.0,Best address in Town ..Great location,https://seattle.craigslist.org/see/apa/d/seattle-best-address-in-town-great/7520578004.html,2.0,890.0
2022-08-17 11:19:00,Belltown,3093.0,Your Peaceful Abode in the Middle of the City,https://seattle.craigslist.org/see/apa/d/seattle-your-peaceful-abode-in-the/7522594626.html,1.0,792.0
2022-08-17 11:18:00,Shoreline,2115.0,#363 - 1x1 With Zen Courtyard View! 4 Wks Free Limited Time Only!,https://seattle.craigslist.org/see/apa/d/seattle-x1-with-zen-courtyard-view-wks/7522593886.html,1.0,762.0
2022-08-17 11:18:00,"400 S Jackson Street  , Seattle, Wa",1825.0,"Bike Storage, Rooftop Deck with BBQ's, Hardwood Floors",https://seattle.craigslist.org/see/apa/d/seattle-bike-storage-rooftop-deck-with/7522593821.html,1.0,536.0
2022-08-17 11:17:00,"Seattle,Belltown,Downtown",2206.0,1BR 1BA apt | Generous cabinets & closets | LUX kitchen | Great views!,https://seattle.craigslist.org/see/apa/d/seattle-1br-1ba-apt-generous-cabinets/7522593596.html,1.0,819.0
2022-08-17 11:17:00,"15300 Southeast 155Th Place, Renton, Wa",2475.0,"Right Around the Corner, Near Everywhere You Want to Be.",https://seattle.craigslist.org/see/apa/d/renton-right-around-the-corner-near/7522593534.html,2.0,1091.0
2022-08-17 11:17:00,Belltown,2795.0,Views From 360Â° Rooftop Are Unbeatable!,https://seattle.craigslist.org/see/apa/d/seattle-views-from-360-rooftop-are/7522593496.html,1.0,
2022-08-17 11:17:00,Vashon Island -- Burton,5000.0,Harbor View Cottage on Vashon Island,https://seattle.craigslist.org/see/apa/d/burton-harbor-view-cottage-on-vashon/7522593419.html,3.0,
2022-08-17 11:16:00,Seattle,2327.0,"Dog Park, On-site maintenance, Microwave",https://seattle.craigslist.org/see/apa/d/seattle-dog-park-on-site-maintenance/7518183791.html,1.0,448.0
2022-08-17 11:15:00,Bell Town,2965.0,Gorgeous 1.5 Bed 1 Bath Apt W Water Views!,https://seattle.craigslist.org/see/apa/d/seattle-gorgeous-15-bed-bath-apt-water/7522592526.html,1.0,794.0
2022-08-17 11:15:00,Seattle,2218.0,Awesome floor plan with walk in closet!,https://seattle.craigslist.org/see/apa/d/lynnwood-awesome-floor-plan-with-walk/7522592507.html,2.0,918.0
2022-08-17 11:15:00,Green Lake,2055.0,"Modern & Lux 1x1 Apt, Just Steps Away From Green Lake!",https://seattle.craigslist.org/see/apa/d/seattle-modern-lux-1x1-apt-just-steps/7522592475.html,1.0,626.0
2022-08-17 11:15:00,Seattle,2187.0,"Smoke Free Building, BBQArea, 100% Walkscore, White Quartz Countertops",https://seattle.craigslist.org/see/apa/d/seattle-smoke-free-building-bbqarea-100/7522592329.html,1.0,554.0
2022-08-17 11:14:00,"308 4Th Ave S , Seattle-Tacoma, Wa",1359.0,"Online Payments Available, Close to Public Transportation, Dishwasher",https://seattle.craigslist.org/see/apa/d/seattle-online-payments-available-close/7522591908.html,,350.0
2022-08-17 11:13:00,Capitol Hill,4135.0,**2B/2B TWO WEEKS FREE**,https://seattle.craigslist.org/see/apa/d/seattle-2b-2b-two-weeks-free/7522591388.html,2.0,847.0
2022-08-17 11:11:00,"Seattle (University District), Wa",7950.0,[Pre-leasing for school year 22-23] 10-bedrm shared housing for group,https://seattle.craigslist.org/see/apa/d/seattle-pre-leasing-for-school-year/7512662082.html,8.0,3126.0
2022-08-17 11:11:00,Seattle,1766.0,Top Floor Studio + Large Walk-In Laundry Room - 6 WEEKS Free,https://seattle.craigslist.org/see/apa/d/seattle-top-floor-studio-large-walk-in/7522590475.html,,585.0
2022-08-17 11:11:00,"Seattle, Roosevelt",2223.0,Brand New 1 Bedroom In Unit Washer/Dryer + 1 Month Free!,https://seattle.craigslist.org/see/apa/d/seattle-brand-new-bedroom-in-unit/7522590337.html,1.0,580.0
2022-08-17 11:11:00,Capitol Hill,2845.0,West Facing 1B/1B in the Heart of Capitol Hill! 24/7 Gym!,https://seattle.craigslist.org/see/apa/d/seattle-west-facing-1b-1b-in-the-heart/7522590208.html,1.0,627.0
2022-08-17 11:10:00,"521 Stadium Place S, Seattle, Wa",1835.0,"Home of the 12's, NFL MLB MLS + MORE!  Experience Downtown Living!!!",https://seattle.craigslist.org/see/apa/d/seattle-home-of-the-12s-nfl-mlb-mls/7522589524.html,,419.0
2022-08-17 11:09:00,"Mt. Baker, Rainier, International District, Beacon Hill",1456.0,This one has it all! Newer Construction! Affordable Community!,https://seattle.craigslist.org/see/apa/d/seattle-this-one-has-it-all-newer/7522588968.html,1.0,517.0
2022-08-17 11:08:00,"2720 4Th Ave Seattle, Wa",2223.0,Transitional 1 bedroom home in a heart of Seattle,https://seattle.craigslist.org/see/apa/d/seattle-transitional-bedroom-home-in/7522580275.html,1.0,680.0
2022-08-17 11:07:00,Seattle,3575.0,ðŸ˜Ž Beautiful Remodeled 3br/2 in Fremont with Private Patio! DAY 6,https://seattle.craigslist.org/see/apa/d/seattle-beautiful-remodeled-3br-in/7522567332.html,3.0,933.0
2022-08-17 11:07:00,"2720 4Th Ave Seattle, Wa",2452.0,$500 off 1st month rent 1bedroom with full of natural sunlight,https://seattle.craigslist.org/see/apa/d/seattle-500-off-1st-month-rent-1bedroom/7522582436.html,1.0,663.0
2022-08-17 11:07:00,"801 Pine Street Seattle, Wa",4247.0,Come Cool Down In Your New Air Conditioned Home!,https://seattle.craigslist.org/see/apa/d/seattle-come-cool-down-in-your-new-air/7522578057.html,2.0,1288.0
2022-08-17 11:06:00,"Seattle, Roosevelt",2073.0,1 Month Free! Brand New Spacious 1 Bedroom With Amazing Views,https://seattle.craigslist.org/see/apa/d/seattle-month-free-brand-new-spacious/7522587834.html,1.0,497.0
2022-08-17 11:06:00,Kent,1879.0,"Walking Trails, Reserved Covered Parking, Reserved Parking",https://seattle.craigslist.org/see/apa/d/seattle-walking-trails-reserved-covered/7522587791.html,2.0,891.0
2022-08-17 11:06:00,"1100 University St Seattle, Wa",4627.0,Pre Lease your Home for September! Amazing views!!,https://seattle.craigslist.org/see/apa/d/seattle-pre-lease-your-home-for/7522587639.html,3.0,1383.0
2022-08-17 11:06:00,Seattle,2695.0,"Newly remodel 2 bd1bath, W/D, parking $2695",https://seattle.craigslist.org/see/apa/d/seattle-newly-remodel-bd1bath-d-parking/7522587316.html,2.0,835.0
2022-08-17 11:05:00,Seattle/Greenwood/Ballard,2299.0,"Corner unit, amazing! Walk in closet!",https://seattle.craigslist.org/see/apa/d/seattle-corner-unit-amazing-walk-in/7514811784.html,2.0,1000.0
2022-08-17 11:05:00,Seattle,3995.0,Spacious 1300 sqft 3 bed/2 bath unit in the heart of Fremont,https://seattle.craigslist.org/see/apa/d/seattle-spacious-1300-sqft-bed-bath/7522586985.html,3.0,1300.0
2022-08-17 11:05:00,Seattle,2295.0,Top Floor Urban 1x1 w/ Covered Private Balcony! Central District,https://seattle.craigslist.org/see/apa/d/seattle-top-floor-urban-1x1-covered/7522586891.html,1.0,
2022-08-17 11:04:00,Steps To Seattle Center & Lake Union,1895.0,South-Facing Studio in South Lake Union,https://seattle.craigslist.org/see/apa/d/seattle-south-facing-studio-in-south/7522580068.html,,463.0
2022-08-17 11:04:00,Seattle,1995.0,Lower level two bedroom/one bathroom apartment in Maple Leaf!,https://seattle.craigslist.org/see/apa/d/seattle-lower-level-two-bedroom-one/7519314534.html,2.0,800.0
2022-08-17 11:04:00,Seattle,2995.0,Lovely Home on a Quiet Street in Victory Heights!,https://seattle.craigslist.org/see/apa/d/seattle-lovely-home-on-quiet-street-in/7511604891.html,3.0,1460.0
2022-08-17 11:04:00,Seattle,3700.0,Classic Craftsman â€“ Lovingly  updated â€“ Available September 1st,https://seattle.craigslist.org/see/apa/d/seattle-classic-craftsman-lovingly/7517313493.html,4.0,1975.0
2022-08-17 11:04:00,"3231 S 204Th St, Seatac, Wa",1639.0,"Flexible Monthly Payments with Flex Rent, Playground, Large Closets",https://seattle.craigslist.org/see/apa/d/seattle-flexible-monthly-payments-with/7517493189.html,1.0,725.0
2022-08-17 11:04:00,Belltown,2979.0,Live Luxuriously at Arrive!,https://seattle.craigslist.org/see/apa/d/seattle-live-luxuriously-at-arrive/7522586525.html,1.0,770.0
2022-08-17 11:04:00,"801 Pine Street Seattle, Wa",4228.0,This Is A Rare! Fully Upgraded 3 Bed In Down Town Seattle.,https://seattle.craigslist.org/see/apa/d/seattle-this-is-rare-fully-upgraded-bed/7522576763.html,3.0,1288.0
2022-08-17 11:04:00,Seattle,3495.0,Steel & Concrete Meet Sophisticated & Modern!,https://seattle.craigslist.org/see/apa/d/seattle-steel-concrete-meet/7520255695.html,2.0,1269.0
2022-08-17 11:04:00,Seattle,6495.0,Modern Queen Anne Home,https://seattle.craigslist.org/see/apa/d/seattle-modern-queen-anne-home/7519749106.html,4.0,2700.0
2022-08-17 11:04:00,Seattle/Greenwood/Ballard,1499.0,Dog/cat friendly/ cozy corner unit,https://seattle.craigslist.org/see/apa/d/seattle-dog-cat-friendly-cozy-corner/7514812302.html,1.0,677.0
2022-08-17 11:04:00,Seattle,1595.0,âœ¨Vintage 1 bd/1ba Ballard! Pet Friendly! CS 5,https://seattle.craigslist.org/see/apa/d/seattle-vintage-bd-1ba-ballard-pet/7522581251.html,1.0,500.0
2022-08-17 11:04:00,Seattle - Pinhurst - Thornton Creek,2900.0,"You Can Live in a Green Oasis - Great Location, Lofty, Open",https://seattle.craigslist.org/see/apa/d/seattle-you-can-live-in-green-oasis/7517024787.html,2.0,2440.0
2022-08-17 11:04:00,"801 Pine Street Seattle, Wa",3903.0,"2-Bdrm 2.5-Ba, Easy Access to Freeway I-5, Paramount Theater & Dining",https://seattle.craigslist.org/see/apa/d/seattle-bdrm-25-ba-easy-access-to/7522579233.html,2.0,1915.0
2022-08-17 11:03:00,Federal Way,1519.0,Looking To Move In Right Away!! We have the Prefect Home For You!,https://seattle.craigslist.org/see/apa/d/federal-way-looking-to-move-in-right/7522586136.html,1.0,592.0
2022-08-17 11:03:00,Seattle,1895.0,One bedroom at the Decatur,https://seattle.craigslist.org/see/apa/d/seattle-one-bedroom-at-the-decatur/7514865351.html,1.0,560.0
2022-08-17 11:03:00,Seattle,3775.0,Belltown Condo with Dramatic Views,https://seattle.craigslist.org/see/apa/d/seattle-belltown-condo-with-dramatic/7520224961.html,2.0,908.0
2022-08-17 11:03:00,"South Lake Union, Seattle",1995.0,Spacious Studio? High quality finishes? In unit w/d? Choose Clark!,https://seattle.craigslist.org/see/apa/d/seattle-spacious-studio-high-quality/7522580943.html,,463.0
2022-08-17 11:03:00,Seattle,3800.0,Attractive3 BDR  Wedgewood Home,https://seattle.craigslist.org/see/apa/d/seattle-attractive3-bdr-wedgewood-home/7511679293.html,3.0,2030.0
2022-08-17 11:03:00,Seattle,3800.0,Large Bryant Home!,https://seattle.craigslist.org/see/apa/d/seattle-large-bryant-home/7514885999.html,3.0,2000.0
2022-08-17 11:03:00,Seattle,2595.0,Top Floor PENTHOUSE with Puget Sound WATER VIEWS,https://seattle.craigslist.org/see/apa/d/seattle-top-floor-penthouse-with-puget/7516145913.html,2.0,1180.0
2022-08-17 11:02:00,"308 Fourth Ave. S, Seattle, Wa",1456.0,"Renovated Interiors, On-Site Laundry, Historic Building",https://seattle.craigslist.org/see/apa/d/seattle-renovated-interiors-on-site/7511608499.html,1.0,132.0
2022-08-17 11:02:00,"2720 4Th Ave Seattle, Wa",3226.0,beautiful 2 bedroom house near Space Needle,https://seattle.craigslist.org/see/apa/d/seattle-beautiful-bedroom-house-near/7522583088.html,2.0,934.0
2022-08-17 11:02:00,Seattle,4200.0,"Beautiful and Bright 2 bedroom, 2.5 bathroom townhous.",https://seattle.craigslist.org/see/apa/d/seattle-beautiful-and-bright-bedroom-25/7520592753.html,2.0,1249.0
2022-08-17 11:02:00,Seattle,3850.0,Corner unit with breathtaking views of Puget Sound & CITY!6wksfree,https://seattle.craigslist.org/see/apa/d/seattle-corner-unit-with-breathtaking/7522585231.html,1.0,1282.0
2022-08-17 11:02:00,Seattle,3500.0,"Charming and immaculate,  2 + bedroom on quiet street in Magnolia.",https://seattle.craigslist.org/see/apa/d/seattle-charming-and-immaculate-bedroom/7517650391.html,2.0,1800.0
2022-08-17 11:02:00,Kirkland,6800.0,"Stunning 4 bedroom, 2.5 bathroom Rose Hill Home For Lease",https://seattle.craigslist.org/see/apa/d/kirkland-stunning-bedroom-25-bathroom/7520523843.html,4.0,2460.0
2022-08-17 11:02:00,Seattle,2745.0,â­Large 2br/2ba with Private Patio! PHH B2,https://seattle.craigslist.org/see/apa/d/seattle-large-2br-2ba-with-private/7522572968.html,3.0,900.0
2022-08-17 11:02:00,Seattle,8250.0,"Beautiful 4 Bedroom, 4.5 Bathroom Stunning View Home in the Inverness",https://seattle.craigslist.org/see/apa/d/seattle-beautiful-bedroom-45-bathroom/7513584042.html,5.0,4230.0
2022-08-17 11:02:00,Seattle,2250.0,Studio loft space in former historic 1908 Queen Anne HS Condominiums,https://seattle.craigslist.org/see/apa/d/seattle-studio-loft-space-in-former/7514966526.html,1.0,597.0
2022-08-17 11:02:00,Seattle,3500.0,"Spectacular 2 bedroom, 2 bathroom FURNISHED condo!",https://seattle.craigslist.org/see/apa/d/seattle-spectacular-bedroom-bathroom/7516460707.html,2.0,1015.0
2022-08-17 11:01:00,Seattle,6500.0,Amazing Mid-Century modern 4+ den bedroom VIEW home in Olympic Manor,https://seattle.craigslist.org/see/apa/d/seattle-amazing-mid-century-modern-den/7511235641.html,4.0,3310.0
2022-08-17 11:01:00,Seattle,6950.0,"Absolutely stunning 5+ bedroom, 3.5 bathroom!",https://seattle.craigslist.org/see/apa/d/seattle-absolutely-stunning-bedroom-35/7514954854.html,5.0,3120.0
2022-08-17 11:01:00,Seattle,4850.0,"BEAUTIFUL and Updated 3 bedroom, 1.75 bathroom Queen Anne Craftsman!",https://seattle.craigslist.org/see/apa/d/seattle-beautiful-and-updated-bedroom/7514867033.html,3.0,2200.0
2022-08-17 11:01:00,"2720 4Th Ave Seattle, Wa",2118.0,cozy 1 bedroom home near Space Needle,https://seattle.craigslist.org/see/apa/d/seattle-cozy-bedroom-home-near-space/7522585007.html,1.0,583.0
2022-08-17 11:01:00,Seattle,2000.0,"Lovely 1 bedroom, 1 bathroom VIEW Condo in Magnolia!!",https://seattle.craigslist.org/see/apa/d/seattle-lovely-bedroom-bathroom-view/7514469673.html,1.0,830.0
2022-08-17 11:01:00,Columbia City,1849.0,Modern Studio in the heart of Columbia City! 1 minute from Light Rail!,https://seattle.craigslist.org/see/apa/d/seattle-modern-studio-in-the-heart-of/7522584982.html,,424.0
2022-08-17 11:01:00,Seattle,4100.0,Newly Remodeled Capitol Hill Craftsman Home For Lease!,https://seattle.craigslist.org/see/apa/d/seattle-newly-remodeled-capitol-hill/7514826681.html,3.0,2010.0
2022-08-17 11:00:00,Kirkland,2995.0,Charming 3-bedroom/1.75-bath split entry home.,https://seattle.craigslist.org/see/apa/d/kirkland-charming-bedroom-175-bath/7520507967.html,3.0,1390.0
2022-08-17 11:00:00,Seattle,3000.0,SPECTACULAR PUGET SOUND AND MOUNTAIN VIEWS,https://seattle.craigslist.org/see/apa/d/seattle-spectacular-puget-sound-and/7519867777.html,1.0,1073.0
2022-08-17 11:00:00,"2720 4Th Ave Seattle, Wa",2323.0,Full water view 1 bedroom home near Space Needle,https://seattle.craigslist.org/see/apa/d/seattle-full-water-view-bedroom-home/7522584565.html,1.0,626.0
2022-08-17 11:00:00,Seattle,3095.0,ðŸ™ŒLarge 3br/1ba with In-Unit Laundry! Pet Friendly! 24-6,https://seattle.craigslist.org/see/apa/d/seattle-large-3br-1ba-with-in-unit/7522577891.html,3.0,1223.0
2022-08-17 11:00:00,Lincoln Park,1995.0,CHARMING TWO BEDROOM APARTMENT,https://seattle.craigslist.org/see/apa/d/seattle-charming-two-bedroom-apartment/7516575296.html,2.0,852.0
2022-08-17 11:00:00,Seattle - Pinehurst - Thornton Creek,2900.0,"LIKE LIVING in a NATIONAL PARK! Light, lofty, open!",https://seattle.craigslist.org/see/apa/d/seattle-like-living-in-national-park/7518499531.html,2.0,2000.0
2022-08-17 11:00:00,Seattle,3872.0,Two Bedroom in the Heart of the Hill! Luxury Living!,https://seattle.craigslist.org/see/apa/d/seattle-two-bedroom-in-the-heart-of-the/7522584298.html,2.0,960.0
2022-08-17 11:00:00,Seattle,2185.0,Newly Renovated One Bedroom One Bath Move In Ready 08/24,https://seattle.craigslist.org/see/apa/d/seattle-newly-renovated-one-bedroom-one/7522584138.html,1.0,
2022-08-17 10:59:00,Seattle,2146.0,"On-Site Maintenance, Fitness Center, Clubhouse, On-Site Management",https://seattle.craigslist.org/see/apa/d/seattle-on-site-maintenance-fitness/7522584080.html,,788.0
2022-08-17 10:59:00,"2720 4Th Ave Seattle, Wa",3611.0,Beautiful 2 bedroom home with Space Needle view,https://seattle.craigslist.org/see/apa/d/seattle-beautiful-bedroom-home-with/7522583900.html,2.0,1049.0
2022-08-17 10:59:00,"First Hill, Capitol Hill, Downtown Seattle",1832.0,Beautifully Updated Studio... Avail Today!,https://seattle.craigslist.org/see/apa/d/seattle-beautifully-updated-studio/7521710880.html,,408.0
2022-08-17 10:59:00,"First Hill, Capitol Hill, Downtown Seattle",1847.0,Updated and Bright Studio Home...Available Now!,https://seattle.craigslist.org/see/apa/d/seattle-updated-and-bright-studio/7521711075.html,,408.0
2022-08-17 10:59:00,"First Hill, Capitol Hill, Downtown Seattle",1867.0,Top Floor Remodeled Studio....Available late August!,https://seattle.craigslist.org/see/apa/d/seattle-top-floor-remodeled/7513256527.html,,408.0
2022-08-17 10:58:00,Seattle,1595.0,âœ¨Vintage 1bd/1ba in Ballard! CS 1,https://seattle.craigslist.org/see/apa/d/seattle-vintage-1bd-1ba-in-ballard-cs/7522579908.html,1.0,500.0
2022-08-17 10:58:00,"5621 22Nd Avenue Nw Seattle, Wa",1895.0,Pet Friendly Community in Luxurious Building,https://seattle.craigslist.org/see/apa/d/seattle-pet-friendly-community-in/7522583372.html,,526.0
